videoId,channelTitle,publishedAt,title,description,Contact,Product 1,Location 1,Product 2,Location 2,Product 3,Location 3,Product 4,Location 4,Product 5,Location 5 ,Product 6,Location 6,製品ID 7,場所 7,製品ID 8,場所 8,製品ID 9,場所 9,製品ID 10,場所 10,製品ID 11,場所 11,製品ID 12,場所 12,製品ID 13,場所 13,製品ID 14,場所 14,製品ID 15,場所 15,製品ID 16,場所 16,製品ID 17,場所 17,製品ID 18,場所 18,製品ID 19,場所 19,製品ID 20,場所 20,製品ID 21,場所 21,製品ID 22,場所 22,製品ID 23,場所 23,製品ID 24,場所 24,製品ID 25,場所 25,製品ID 26,場所 26,製品ID 27,場所 27,製品ID 28,場所 28,製品ID 29,場所 29,製品ID 30,場所 30,製品ID 31,場所 31,製品ID 32,場所 32,製品ID 33,場所 33,製品ID 34,場所 34,製品ID 35,場所 35,製品ID 36,場所 36,製品ID 37,場所 37,製品ID 38,場所 38,製品ID 39,場所 39,製品ID 40,場所 40,製品ID 41,場所 41,製品ID 42,場所 42,製品ID 43,場所 43,製品ID 44,場所 44,製品ID 45,場所 45,製品ID 46,場所 46
WgBTc3o08yo,アオイの。,2020-10-10 22:00:28+00:00,【秋メイク】私の最近のお気に入りブラウンキラキラメイクを紹介！,最近の私の気分はブラウンキラキラメイク！ どんなファッションにも合うし、リップも合わせやすいメイクで最近よくするよー！,〇,ラ ロッシュ ポゼ　UVイデア XL プロテクショントーンアップ,下地,シャネル　レ ベージュ フリュイド アンルミネール ベル ミン,頬,シャネル　レ ベージュ フリュイド アンルミネール ベル ミン,額,シャネル　レ ベージュ フリュイド アンルミネール ベル ミン,鼻,シャネル　レ ベージュ フリュイド アンルミネール ベル ミン,瞼上,シャネル　レ ベージュ タン ベル ミン イドゥラタン / B20,ファンデーション,NARS　ライトリフレクティングセッティングパウダー プレスト N,パウダー,ルナソル　スタイリングアイゾーンコンパクト　（？）,眉,エクセル　パウダー&ペンシル アイブロウEX / PD05 グレイッシュブラウン,眉,M・A・C　ウォータープルーフ ブロウ セット / レッド チェスナット,眉,NARS　シングルアイシャドー / 5319,瞼上,NARS　シングルアイシャドー / 5319,瞼下,NARS　シングルアイシャドー / 5338,瞼上,NARS　シングルアイシャドー / 5338,瞼下,NARS　ナーズイスト ウォンテッド ミニアイシャドーパレット　（２）,瞼下,M・A・C　M・A・C パワーポイント アイ ペンシル / スタボーン ブラウン,アイライン上,資生堂　アイラッシュカーラー 213,まつ毛上,オペラ　マイラッシュ アドバンスト / 01 ブラック,まつ毛上,アディクション　ザ カラー リキッド アイライナー / 002 Rusty Brunette,アイライン上,クリニーク　チーク ポップ / 05 ヌード ポップ,頬,NARS　オーバーラスト チークパレット　（１）,鼻,シャネル　ルージュ ココ フラッシュ / 53 シックネス,口,Celvoke　ディグニファイド リップス / 04,口,,,,,,,,,,,,,,,,,,,,,,,,,,,,,,,,,,,,,,,,,,,,,,
w9cN_Zho4z4,mizuno yuka水野 祐香,2019-09-17 19:00:10+00:00,【整形メイク】アラフォーだけどアラサーに見える秋の毎日メイク【Everyday Makeup】,やっぱり若返りたい、昔のままのメイクから抜け出せない、年相応のメイクにすると地味ージョになって悲しい、肌年齢を少し ...,Femii by AngelColor　ナチュラルモーヴ,NARS　スムース＆プロテクトプライマー,下地,ディオール　フィックス イット カラー / 3N イエロー,コンシーラー,the SAEM　CPチップコンシーラー / 02 リッチベージュ,コンシーラー,ディオール　ディオールスキン フォーエヴァー フルイド グロウ / 2Wウォーム,ファンデーション,イヴ・サンローラン　ラディアント タッチ / 2 ルミナスアイボリー,額,イヴ・サンローラン　ラディアント タッチ / 2 ルミナスアイボリー,口,イニスフリー　ノーセバム ミネラルパウダー,パウダー,セザンヌ　ノーズ＆アイブロウパウダー / 01キャメル　（１）,鼻,セザンヌ　ノーズ＆アイブロウパウダー / 01キャメル　（２）　〓〓〓　セザンヌ　ノーズ＆アイブロウパウダー / 01キャメル　（３）,眉,セザンヌ　ノーズ＆アイブロウパウダー / 01キャメル　（２）,眉,ヘビーローテーション　カラーリングアイブロウ / 04 ナチュラルブラウン,眉,イヴ・サンローラン　ラディアント タッチ / 2 ルミナスアイボリー,眉,ロレアル パリ　アイシャドウ メガパレット / 01 CHERRY MY CHERI　（５）,瞼上,ロレアル パリ　アイシャドウ メガパレット / 01 CHERRY MY CHERI　（１５）,瞼上,ロレアル パリ　アイシャドウ メガパレット / 01 CHERRY MY CHERI　（１５）,瞼下,ロレアル パリ　アイシャドウ メガパレット / 01 CHERRY MY CHERI　（１）,瞼上,キャンメイク　クリーミータッチライナー / No.02 ミディアムブラウン,アイライン上,ロレアル パリ　アイシャドウ メガパレット / 01 CHERRY MY CHERI　（１６）,アイライン上,アイプチ　ひとえ・奥ぶたえ用カーラー,まつ毛上,エテュセ　ラッシュバージョンアップ,まつ毛上,ロレアル パリ　ル バー ア ブラッシュ / 08シティ エクスプローラー,頬,[ハイライト],鼻,[ハイライト],頬,[ハイライト],口,[ハイライト],顎,オペラ　マイラッシュ アドバンスト / 01 ブラック,まつ毛上,オペラ　マイラッシュ アドバンスト / 01 ブラック,まつ毛下,Celvoke　エンスロール グロス / 03:テラコッタ,口,,,,,,,,,,,,,,,,,,,,,,,,,,,,,,,,,,,,
g2x37nZHwQw,benio店長 / ASMR屋さん,44841.29167,【ASMR】毎日メイクをする音??(囁き声/マウスサウンド),ASMR #年中秋メイク好き 本日は、以前からリクエストをいただいてたメイクアップASMRをお届けします！  ???自分が何べ ...,MeniMoon Luna Beige,イニスフリー　ミネラル メイクアップ ベース N　3.Purple color,下地,イプサ　クリエイティブ オイル (シアーゴールド),下地,クラランス　フィックス メイクアップ,化粧水,3CE　スタジオフェイス ターニング コンシーラーパレット　（４）,コンシーラー,3CE　スタジオフェイス ターニング コンシーラーパレット　（１）,コンシーラー,3CE　スタジオフェイス ターニング コンシーラーパレット　（２）,コンシーラー,TIRTIR　MASK FIT RED CUSHION / 17C PORCELAIN,ファンデーション,M・A・C　スタジオ コンシール アンド コレクト パレット / ライト　（２）　〓〓〓　M・A・C　スタジオ コンシール アンド コレクト パレット / ライト　（４）,鼻,M・A・C　スタジオ コンシール アンド コレクト パレット / ライト　（２）　〓〓〓　M・A・C　スタジオ コンシール アンド コレクト パレット / ライト　（４）,口,too cool for school　アートクラスバイロダンシェーディングマスター / 02モダン　（２，３）,顔,CLIO　プリズム エアー ハイライター / 1号 ゴールドシアー,鼻,CLIO　プリズム エアー ハイライター / 1号 ゴールドシアー,口,CLIO　プリズム エアー ハイライター / 1号 ゴールドシアー,顎,CLIO　プリズム エアー ハイライター / 1号 ゴールドシアー,頬,セザンヌ　ノーズ＆アイブロウパウダー / 01キャメル　（１）　〓〓〓　セザンヌ　ノーズ＆アイブロウパウダー / 01キャメル　（２）,眉,ケイト　3DアイブロウカラーN / BR-5 ローズブラウン,眉,CipiCipi　ドレッシーシャドウR / 02 ピーチタルト　（１）,瞼上,CipiCipi　ドレッシーシャドウR / 02 ピーチタルト　（２）,瞼上,CipiCipi　ドレッシーシャドウR / 02 ピーチタルト　（２）,瞼下,CipiCipi　ドレッシーシャドウR / 02 ピーチタルト　（４）,瞼上,CipiCipi　ドレッシーシャドウR / 02 ピーチタルト　（３）,瞼上,ケイト　ダブルラインエキスパート / LB-1,瞼下,ケイト　ダブルラインエキスパート / LB-1,口,セザンヌ　極細アイライナー EX / 00 ブラウンブラック,アイライン上,セザンヌ　極細アイライナー EX　00 ブラウンブラック,アイライン下,ローラ メルシエ　ブラッシュ カラー インフュージョン　09 ピーチ,頬,ローラ メルシエ　ブラッシュ カラー インフュージョン　09 ピーチ,鼻,ローラ メルシエ　ブラッシュ カラー インフュージョン / 09 ピーチ,口,mude　MDインスパイアロングラッシュカーリングマスカラ　#01 ブラック,まつ毛上,mude　MDインスパイアロングラッシュカーリングマスカラ　#01 ブラック,まつ毛下,マジョリカ マジョルカ　シャドーカスタマイズ / BE286 ゴージャス姉妹,瞼下,CipiCipi　グリッターイルミネーションライナー / 02 トゥインクルスター,瞼下,エレガンス　ラ プードル オートニュアンス / I エレガント,パウダー,the SAEM　キスホリック リップスティック / BR01 サンドウォッシュ,口,ハニーロア　ハニーラスター r　04 Clematis (クレマティス),口,,,,,,,,,,,,,,,,,,,,,,
,,,,,,,,,,,,,,,,,,,,,,,,,,,,,,,,,,,,,,,,,,,,,,,,,,,,,,,,,,,,,,,,,,,,,,,,,,,,,,,,,,,,,,,,,,,,,,,,,
,,,,,,,,,,,,,,,,,,,,,,,,,,,,,,,,,,,,,,,,,,,,,,,,,,,,,,,,,,,,,,,,,,,,,,,,,,,,,,,,,,,,,,,,,,,,,,,,,
LlQcBTySUdw,HIRO BEAUTY CHANNEL,2023-07-15 19:00:15+00:00,UC8oF7jmQsKbMVrCv5LrP32w,【秋コスメ】今季はアイシャドウが豊作よ🩶 小田切ヒロおすすめの新作秋コスメ！-アイメイク編-,みなさん、こんにちは。ヘア＆メイクアップアーティストの小田切ヒロです。 今回は、「おすすめの新作秋コスメ -アイメイク ...,×,,,,,,,,,,,,,,,,,,,,,,,,,,,,,,,,,,,,,,,,,,,,,,,,,,,,,,,,,,,,,,,,,,,,,,,,,,,,,,,,,,,,,,,,,,,
IxfE7TTZ3P0,さくらチャンネル,2023-09-01 18:00:11+00:00,UC6f1jmmHhgtTA17nhFDX1pw,絶対に盛れたい日のさくら流毎日メイクを紹介します💚💚,今日もさくらチャンネル見てくれて有難う❤︎ チャンネル登録よろしくお願い致します ▷SNS followよろしくね☁️ TikTok： ...,×,,,,,,,,,,,,,,,,,,,,,,,,,,,,,,,,,,,,,,,,,,,,,,,,,,,,,,,,,,,,,,,,,,,,,,,,,,,,,,,,,,,,,,,,,,,
KoNwhw0VmnI,水越みさと,2023-09-09 19:00:16+00:00,UCffg7iYU2K7HFJDhylZzUBw,【2023年新作コスメ】秋冬コスメプチプラ&amp;デパコス最近の新作アイテムまとめてレビュー〈セザンヌ/カネボウ/Dior〉,00:00 オープニング 00:20 カネボウ コンフォートスキン ウェア 04:00 SUQQU ザファンデーション 110 07:40 SUQQU ザ ルース ...,△,,,,,,,,,,,,,,,,,,,,,,,,,,,,,,,,,,,,,,,,,,,,,,,,,,,,,,,,,,,,,,,,,,,,,,,,,,,,,,,,,,,,,,,,,,,
CXlhrLizUfk,nanakoななこ,2020-02-13 14:16:04+00:00,UC3swo6utVXOSYwxazwoKWBQ,【女子ウケ】GRWM 一緒に準備しよ！🤎爆盛こっくりオレンジブラウンメイク🤎プチプラコスメで濃いメイク！【イベントメイク】,初グッズはこちらから           https://muuu.com/videos/93ae1f42324791a1 こんにちは！ななこです！ 今日もご視聴 ...,×,,,,,,,,,,,,,,,,,,,,,,,,,,,,,,,,,,,,,,,,,,,,,,,,,,,,,,,,,,,,,,,,,,,,,,,,,,,,,,,,,,,,,,,,,,,
yqt902x2sOU,nanakoななこ,2022-03-31 19:27:41+00:00,UC3swo6utVXOSYwxazwoKWBQ,【超基礎】初心者メイク徹底解説！ドラックストアで買えるプチプラコスメのみ！技術・使い方・順番など！完全保存版！【学生必見】,お待たせいたしました！ とりあえずこれ見とけばわかるようになる初心者メイクです！ メイクって工程もやることもコツも ...,×,,,,,,,,,,,,,,,,,,,,,,,,,,,,,,,,,,,,,,,,,,,,,,,,,,,,,,,,,,,,,,,,,,,,,,,,,,,,,,,,,,,,,,,,,,,
u0DXoOxsc6Y,さしはらちゃんねる,2023-06-20 18:00:39+00:00,UCfnSEB4atVWATf6vzepHzqw,最近のメイクはこんな感じです！,使用コスメ↓ 大体順番通りなのですがバラバラだったらごめんなさい   クレ・ド・ポー ボーテ ヴォワールコレクチュールn ...,×,,,,,,,,,,,,,,,,,,,,,,,,,,,,,,,,,,,,,,,,,,,,,,,,,,,,,,,,,,,,,,,,,,,,,,,,,,,,,,,,,,,,,,,,,,,
xr2TSA0dvCg,五彩緋夏 ひなちゃん5しゃい,2023-03-07 19:53:30+00:00,UCLdEdYIPup_1t03dP0tTJqw,韓国JKメイクが無彩色でたまらん可愛い,,×,,,,,,,,,,,,,,,,,,,,,,,,,,,,,,,,,,,,,,,,,,,,,,,,,,,,,,,,,,,,,,,,,,,,,,,,,,,,,,,,,,,,,,,,,,,
4M1MxWXxnYQ,水越みさと,2023-01-21 19:00:02+00:00,UCffg7iYU2K7HFJDhylZzUBw,【濃いメイク似合わない人】メイクするほど不自然になってしまう方に見てほしい。しっかり盛れるナチュラルメイク♡,タイムテーブルはまた時間のある時に書きますね！ ＊Instagram＊https://www.instagram.com/mitan.m/ ...,×,,,,,,,,,,,,,,,,,,,,,,,,,,,,,,,,,,,,,,,,,,,,,,,,,,,,,,,,,,,,,,,,,,,,,,,,,,,,,,,,,,,,,,,,,,,
xpsJ1KOR1gM,momoho channel,2023-05-13 20:00:45+00:00,UCf7068tmqBCLPAe91BB3WwQ,超盛れる最近の毎日メイク徹底解説する！💐,こんにちはももほです   今日は超お久しぶりの 毎日メイクでした♡ どうでしたでしょうか…！ 本当に本当におすすめコスメしか ...,×,,,,,,,,,,,,,,,,,,,,,,,,,,,,,,,,,,,,,,,,,,,,,,,,,,,,,,,,,,,,,,,,,,,,,,,,,,,,,,,,,,,,,,,,,,,
hz9G_t-JagE,きりまる,2023-08-09 20:01:25+00:00,UCI_xeCXCHd_iTdOG6OIZYiA,【保存版】イエベに合う毎日メイクを徹底解説🔰過去イチ褒められた。じゅわっと血色であざと可愛く♡,久々の毎日メイク徹底解説でございました    ♡ わたしはPCがイエベ春っていうのもあるけど 基本的に、こういうコーラルとか ...,×,,,,,,,,,,,,,,,,,,,,,,,,,,,,,,,,,,,,,,,,,,,,,,,,,,,,,,,,,,,,,,,,,,,,,,,,,,,,,,,,,,,,,,,,,,,
5saPypqc8IM,nanakoななこ,2020-09-01 19:00:02+00:00,UC3swo6utVXOSYwxazwoKWBQ,【過去一盛れた】イニスフリー縛りで今からできる秋メイク！テラコッタオレンジイエローメイク（？）お気に入り大量発掘！グリッター紹介【プチプラ】【韓国コスメ】,提供：Qoo10 innisfree ↓今回動画で紹介した商品はコチラをチェック↓ https://bit.ly/2ElfIEa 9/1～9/10までメガ割セール実施中！,△,,,,,,,,,,,,,,,,,,,,,,,,,,,,,,,,,,,,,,,,,,,,,,,,,,,,,,,,,,,,,,,,,,,,,,,,,,,,,,,,,,,,,,,,,,,
mfyVT8PYRz4,HIRO BEAUTY CHANNEL,2023-08-06 19:00:42+00:00,UC8oF7jmQsKbMVrCv5LrP32w,【2023年秋】小田切ヒロが厳選したおすすめコスメ！この秋大活躍するベースメイクアイテム全部紹介します！,みなさん、こんにちは。ヘア＆メイクアップアーティストの小田切ヒロです。 今回は、「2023年秋のおすすめベースメイク」のご ...,×,,,,,,,,,,,,,,,,,,,,,,,,,,,,,,,,,,,,,,,,,,,,,,,,,,,,,,,,,,,,,,,,,,,,,,,,,,,,,,,,,,,,,,,,,,,
mTxa4CiT1Is,五彩緋夏 ひなちゃん5しゃい,2022-05-06 18:22:46+00:00,UCLdEdYIPup_1t03dP0tTJqw,メイクLOOKBOOK❤︎パーソナルカラー別メイク徹底解説！,5/9朝10時〜Armujeのリップ全色が再販になります♡ 下のオンラインショップで購入してね   https://shop.armuje.com/ 店舗販売 ...,×,,,,,,,,,,,,,,,,,,,,,,,,,,,,,,,,,,,,,,,,,,,,,,,,,,,,,,,,,,,,,,,,,,,,,,,,,,,,,,,,,,,,,,,,,,,
OzWHdaHcZMQ,nanakoななこ,2023-05-28 23:17:47+00:00,UC3swo6utVXOSYwxazwoKWBQ,【プチプラ縛り】あざとい全人類ウケたぬき顔メイク！中顔面短縮！！初心者OK🔰デートメイク【ほぼキャンメイクとセザンヌ】【合コンメイク】,ご視聴ありがとうございます❤︎チャンネル登録よろしくね/ ○コスメブランド  leur charme 公式HP https://leurcharme.jp ...,×,,,,,,,,,,,,,,,,,,,,,,,,,,,,,,,,,,,,,,,,,,,,,,,,,,,,,,,,,,,,,,,,,,,,,,,,,,,,,,,,,,,,,,,,,,,
OzWHdaHcZMQ,nanakoななこ,2023-05-28 23:17:47+00:00,UC3swo6utVXOSYwxazwoKWBQ,【プチプラ縛り】あざとい全人類ウケたぬき顔メイク！中顔面短縮！！初心者OK🔰デートメイク【ほぼキャンメイクとセザンヌ】【合コンメイク】,ご視聴ありがとうございます❤︎チャンネル登録よろしくね/ ○コスメブランド  leur charme 公式HP https://leurcharme.jp ...,×,,,,,,,,,,,,,,,,,,,,,,,,,,,,,,,,,,,,,,,,,,,,,,,,,,,,,,,,,,,,,,,,,,,,,,,,,,,,,,,,,,,,,,,,,,,
pgQd_z8kvEg,HIRO BEAUTY CHANNEL,2023-08-09 19:15:03+00:00,UC8oF7jmQsKbMVrCv5LrP32w,【完全保存版】小田切ヒロ直伝！一重さんのアイメイクの基本！ おすすめのまつ毛の上げ方やアイラインの引き方など教えちゃうわよ〜🤍,みなさん、こんにちは。ヘア＆メイクアップアーティストの小田切ヒロです。 今回は、「一重さんのアイメイクの基本！」のご ...,×,,,,,,,,,,,,,,,,,,,,,,,,,,,,,,,,,,,,,,,,,,,,,,,,,,,,,,,,,,,,,,,,,,,,,,,,,,,,,,,,,,,,,,,,,,,
