videoId,channelTitle,publishedAt,title,description,Contact,Product 1,Location 1,Product 2,Location 2,Product 3,Location 3,Product 4,Location 4,Product 5,Location 5 ,Product 6,Location 6,製品ID 7,場所 7,製品ID 8,場所 8,製品ID 9,場所 9,製品ID 10,場所 10,製品ID 11,場所 11,製品ID 12,場所 12,製品ID 13,場所 13,製品ID 14,場所 14,製品ID 15,場所 15,製品ID 16,場所 16,製品ID 17,場所 17,製品ID 18,場所 18,製品ID 19,場所 19,製品ID 20,場所 20,製品ID 21,場所 21,製品ID 22,場所 22,製品ID 23,場所 23,製品ID 24,場所 24,製品ID 25,場所 25,製品ID 26,場所 26,製品ID 27,場所 27,製品ID 28,場所 28,製品ID 29,場所 29,製品ID 30,場所 30,製品ID 31,場所 31,製品ID 32,場所 32,製品ID 33,場所 33,製品ID 34,場所 34,製品ID 35,場所 35,製品ID 36,場所 36,製品ID 37,場所 37,製品ID 38,場所 38,製品ID 39,場所 39,製品ID 40,場所 40,製品ID 41,場所 41,製品ID 42,場所 42,製品ID 43,場所 43,製品ID 44,場所 44,製品ID 45,場所 45,製品ID 46,場所 46
MY7T3Ankfdw,nanakoななこ,2020-09-14 01:53:27+00:00,【重大発表あり】好きを詰め込んだ自分ウケ！透明感爆発濃いボルドーメイク！崩れないメイク法と落ちないリップの塗り方！最強可愛いグリッター紹介！（最後重大発表ある）【秋メイク】【マスクメイク】,ご視聴ありがとうございます！❤︎／ ポールアンドジョー プロテクティングファンデーションプライマーS01 ¥2880 KATE ...,Angelcolor　Pearl Gray,ポール ＆ ジョー ボーテ　プロテクティング ファンデーション プライマー S / 01 ドラジェ,下地,ケイト　パウダリースキンメイカー / 00 明るく透明感のある肌,ファンデーション,イプサ　クリエイティブコンシーラーe　（２）,コンシーラー,the SAEM　CPチップコンシーラー / グリーンベージュ,コンシーラー,イニスフリー　ノーセバム ミネラルカラーパウダー / 1 バイオレット,瞼上,[二重],二重,ちふれ アイブロー ペンシル くり出し式 / 21 ライトブラウン,眉,キャンメイク　カラーチェンジアイブロウ / No.04 モカベージュ,眉,ちふれ アイブロー ペンシル くり出し式 / 21 ライトブラウン,瞼下,CLIO　キル カバー エアリーフィット コンシーラー / 2 LINGERIE ランジェリー,瞼下,ケイト　マルチコントゥアペンシル / 02,鼻,ケイト　マルチコントゥアペンシル / 02,口,PERIPERA(韓国) インクブイシェーディング / ＃03,顔,ロレアル パリ　ル バー ア ブラッシュ / 15パッショネイト,鼻,ロレアル パリ　ル バー ア ブラッシュ / 15パッショネイト,額,ロレアル パリ　ル バー ア ブラッシュ / 15パッショネイト,口,ロレアル パリ　ル バー ア ブラッシュ / 15パッショネイト,頬,エチュード　ラブリー クッキー ブラッシャー / PK004,頬,エチュード　ラブリー クッキー ブラッシャー / PK004,鼻,キャンメイク　マシュマロフィニッシュパウダー / MP マットピンクオークル,パウダー,rom&nd　ジューシーラスティングティント / 17 PLUM COKE,口,セザンヌ　ナチュラル チークN / 17 ウォームブラウン,眉,キャンメイク　シルキースフレアイズ / No.04 サンセットデート　（１）,瞼上,セザンヌ　ナチュラル チークN / 17 ウォームブラウン,瞼下,エチュード　プレイカラー アイシャドウ / ワインパーティー　（６）,瞼上,エチュード　プレイカラー アイシャドウ / ワインパーティー　（７）,瞼上,エチュード　プレイカラー アイシャドウ / ワインパーティー　（３）　〓〓〓　エチュード　プレイカラー アイシャドウ / ワインパーティー　（４）,瞼下,セザンヌ　描くふたえアイライナー / ？,アイライン下,CLIO　ウォータープルーフ ペン ライナー / 04 MAROON BROWN,アイライン上,msh(エム・エス・エイチ)　ラブ・ライナー リキッドアイライナー グリッターコレクション2 / ボルドーブラウン,アイライン上,ディオール　ディオール バックステージ アイ パレット / 003 アンバー　（２）,瞼下,3CE アイスイッチ / PETAL,瞼下,ホリカホリカ　ジョイフルコレクション アイ スパングリッター,瞼下,M・A・C　ダズルシャドウ / シャイン デライト,瞼上,A’pieu（アピュー） ジューシーパン ティント / ？,口,セザンヌ ナチュラル チークN / 17 ウォームブラウン,頬,マジョリカ マジョルカ　ラッシュエキスパンダー ロングロングロング / RD400,口,,,,,,,,,,,,,,,,,,
8KcKZS8COyo,nanakoななこ,2023-09-16 22:28:07+00:00,【今日から留学！】日本最後なので今一番盛れる毎日メイクを紹介しました！ガッツリ盛るのにナチュラル！乾燥させずに崩さない、濃く見えない！【秋メイク】【１軍コスメ】,ご視聴ありがとうございます❤︎チャンネル登録よろしくね/ ○コスメブランド  leur charme 公式HP https://leurcharme.jp ...,あり,キャンメイク　マーメイドスキンジェルUV / C01：CICA※ミント,下地,マーシュ・フィールド　マーシュフィールド SC クリームファンデS / 16,瞼下,23years old　ダーマシンコンシーラー / 1号 グロウベージュ,コンシーラー,UR GLAM　スリム スケッチ アイブロウ ペンシル / バーガンディブラウン,眉,ヘビーローテーション　カラーリングアイブロウ / 09 ナチュラルアッシュ,眉,WAKEMAKE　wakemake ミックスブラーリング ボリュームブラッシャー / #02,鼻,WAKEMAKE　wakemake ミックスブラーリング ボリュームブラッシャー / #02,口,WAKEMAKE　wakemake ミックスブラーリング ボリュームブラッシャー / #02,顔,CLIO　プリズムハイライターデュオ / 01 クリーム フィズ　（１）,鼻,CLIO　プリズムハイライターデュオ / 01 クリーム フィズ　（２）,鼻,CLIO　プリズムハイライターデュオ / 01 クリーム フィズ　（１）,口,CLIO　プリズムハイライターデュオ / 01 クリーム フィズ　（１）,顎,CLIO　プリズムハイライターデュオ / 01 クリーム フィズ　（１）,頬,メイクアップフォーエバー　ウルトラHDプレストパウダー / 01 トランスルーセント,額,メイクアップフォーエバー　ウルトラHDプレストパウダー / 01 トランスルーセント,鼻,メイクアップフォーエバー　ウルトラHDプレストパウダー / 01 トランスルーセント,頬,leur charme　forever fit rouge / 04 guilty pink(ギルティピンク),口,FORENCOS　ピュアブラッシャー / 01 Rabbit（ラビット）,頬,FORENCOS　ピュアブラッシャー / 01 Rabbit（ラビット）,鼻,アストレア ヴィルゴ　アイビューティーフィクサーWP,二重,CLIO　プロアイパレットエア / 01 コーラルスタジオ　（２）,瞼上,CLIO　プロアイパレットエア / 01 コーラルスタジオ　（２）,瞼下,CLIO　プロアイパレットエア / 01 コーラルスタジオ　（５）　〓〓〓　CLIO　プロアイパレットエア / 01 コーラルスタジオ　（１０）,瞼上,マジョリカ マジョルカ　シャドーカスタマイズ / BE286 ゴージャス姉妹,瞼下,leur charme　leur charme マテリアルカラーパレット / 01 フランボワーズココ　（９）,瞼下,leur charme　leur charme マテリアルカラーパレット / 01 フランボワーズココ　（８）,瞼下,leur charme　leur charme マテリアルカラーパレット / 01 フランボワーズココ　（７）　〓〓〓　leur charme　leur charme マテリアルカラーパレット / 01 フランボワーズココ　（８）,瞼下,leur charme　leur charme マテリアルカラーパレット / 01 フランボワーズココ　（９）,アイライン下,キャンメイク　シルキースフレアイズ(マットタイプ) / M01 シエナウッド　（３）,アイライン上,キャンメイク　シルキースフレアイズ(マットタイプ) / M01 シエナウッド　（３）,瞼上,leur charme　leur charme マテリアルカラーパレット / 02 タルトタタンポム　（６）,瞼上,CATKIN　山海魂シリーズ 鮫人の涙のリキッドシャドウ / C02,瞼下,CATKIN　山海魂シリーズ 鮫人の涙のリキッドシャドウ / C02,瞼上,ヒロインメイク　プライムリキッドアイライナー リッチキープ / 02 ブラウンブラック,アイライン上,キャンメイク　シルキースフレアイズ(マットタイプ) / M01 シエナウッド　（３）,アイライン上,コージー　カービングアイラッシュカーラー,まつ毛上,コーセーコスメニエンス　カールキープマジック / クリアブラック,まつ毛上,コーセーコスメニエンス　カールキープマジック / クリアブラック,まつ毛下,leur charme　forever fit rouge / 01 mood plum(ムードプラム),口,,,,,,,,,,,,,,
S91i4jfGjHg,水越みさと,2021-09-25 20:00:11+00:00,【河北メイク】プロ技満載◎河北裕介さんと初コラボ！半顔秋メイク,河北さんとのコラボ動画はこちら →https://youtu.be/lQImweqU5BQ 河北裕介さん □YouTube ...,〇,毛穴パテ職人　テカリ防止下地,下地,エトヴォス　ミネラルインナートリートメントベース / ？,下地,RMK　RMK ルミナス ペンブラッシュコンシーラー / 04,コンシーラー,RMK　RMK ルミナス ペンブラッシュコンシーラー / 04,瞼上,ジバンシイ　プリズム・リーブル・スキンケアリング・グロウ / 1-W100,ファンデーション,NARS　ライトリフレクティングセッティングパウダー プレスト N / ？,パウダー,＆be(アンドビー)　パレットアイシャドウ(旧) / サンライズブラウン　（１）　〓〓〓　＆be(アンドビー)　パレットアイシャドウ(旧) / サンライズブラウン　（２）,瞼上,＆be(アンドビー)　パレットアイシャドウ(旧) / サンライズブラウン　（１）　〓〓〓　＆be(アンドビー)　パレットアイシャドウ(旧) / サンライズブラウン　（２）,瞼下,＆be(アンドビー)　パレットアイシャドウ(旧) / サンライズブラウン　（３）,瞼上,＆be(アンドビー)　&be ペンシルアイライナー / カーキ,アイライン上,[ビューラー],まつ毛上,キャンメイク　クイックラッシュカーラー / BO ベイクドオレンジ,まつ毛上,イプサ　アイブロウ クリエイティブパレット　（２）,眉,イプサ　アイブロウ クリエイティブパレット　（１）,鼻,デジャヴュ　アイブロウカラー / ウォームブラウン,眉,SUQQU(スック)　コンフォート リップ フルイド フォグ / 08 春摘 -HARUTSUMI,口,,,,,,,,,,,,,,,,,,,,,,,,,,,,,,,,,,,,,,,,,,,,,,,,,,,,,,,,,,,,
S91i4jfGjHg,水越みさと,2021-09-25 20:00:11+00:00,【河北メイク】プロ技満載◎河北裕介さんと初コラボ！半顔秋メイク,河北さんとのコラボ動画はこちら →https://youtu.be/lQImweqU5BQ 河北裕介さん □YouTube ...,〇,＆be(アンドビー)　UVミルク / スタンダード 116g,下地,＆be(アンドビー)　ファンシーラー / ベージュ＆オレンジ　（１）,コンシーラー,＆be(アンドビー)　ファンシーラー / ベージュ＆オレンジ　（２）,コンシーラー,＆be(アンドビー)　プレストクリアパウダー,パウダー,＆be(アンドビー)　スムースパウダー,パウダー,＆be(アンドビー)　コントゥアペン,顔,＆be(アンドビー)　グロウハイライター,瞼下,＆be(アンドビー)　グロウハイライター,頬,＆be(アンドビー)　クリームアイシャドウ / ニュートラルブラウン,瞼上,＆be(アンドビー)　パレットアイシャドウ(旧) / サンライズブラウン　（１）　〓〓〓　＆be(アンドビー)　パレットアイシャドウ(旧) / サンライズブラウン　（２）,瞼上,＆be(アンドビー)　パレットアイシャドウ(旧) / サンライズブラウン　（１）　〓〓〓　＆be(アンドビー)　パレットアイシャドウ(旧) / サンライズブラウン　（２）,瞼下,＆be(アンドビー)　パレットアイシャドウ(旧) / サンライズブラウン　（３）　〓〓〓　＆be(アンドビー)　パレットアイシャドウ(旧) / サンライズブラウン　（４）,瞼上,＆be(アンドビー)　&be ペンシルアイライナー / カーキ,アイライン上,＆be(アンドビー)　&be マスカラ / ブラック,まつ毛上,＆be(アンドビー)　パレットアイブロウ / オレンジブラウン　（１）,眉,＆be(アンドビー)　パレットアイブロウ / オレンジブラウン　（２）,眉,＆be(アンドビー)　&be アイブロウマスカラ / モーブブラウン,眉,＆be(アンドビー)　&be リキッドアイブロウ / ダークブラウン,眉,SUQQU(スック)　コンフォート リップ フルイド フォグ / 08 春摘 -HARUTSUMI,口,,,,,,,,,,,,,,,,,,,,,,,,,,,,,,,,,,,,,,,,,,,,,,,,,,,,,,
T3BCRk7qPCo,AmiBeautyTV,2017-10-20 20:18:36+00:00,秋のキャラメルラテメイク/秋メイク/MY EVERYDAY FALL MAKEUP/2017,まず、ただいま！！！ そして待っててくれた方優しい言葉を沢山くださった方 本当にありがとうございます。 お休みする前の数 ...,〇,[アイテープ],二重,MARC JACOBS BEAUTY　リマーカブルフルカラーファンデーション　〓〓〓　NARS シアーグローファンデーション / 6044,ファンデーション,the SAEM　CPチップコンシーラー / 1.25 ライトベージュ,コンシーラー,キャンメイク　マシュマロフィニッシュパウダー / ？,パウダー,SKINFOOD(スキンフード)　ピーチコットン マルチフィニッシュパウダー,パウダー,ビボ ビボ アイフル マユズミA,眉,キャンメイク　クイックエアリーアイブロウ / 02 スウィートピーチティー,眉,ヴィセ　リシェ カラーリング アイブロウマスカラ / ？,眉,[?],瞼上,tarte　タルティスト プロ アマゾニアンクレイ パレット　（１１）,瞼上,tarte　タルティスト プロ アマゾニアンクレイ パレット　（３）,瞼上,tarte　タルティスト プロ アマゾニアンクレイ パレット　（２）,瞼下,tarte　タルティスト プロ アマゾニアンクレイ パレット　（３）,瞼下,tarte　タルティスト プロ アマゾニアンクレイ パレット　（４）,アイライン上,tarte　タルティスト プロ アマゾニアンクレイ パレット　（４）,アイライン下,NARS　ラージャーザンライフ ロングウェアアイライナー / 8063 (47TH STREET),アイライン上,NARS　ラージャーザンライフ ロングウェアアイライナー / 8063 (47TH STREET),アイライン下,マキアージュ　エッジフリー アイラッシュカーラー,まつ毛上,ヒロインメイク　ロング＆カールマスカラ スーパーWP / 01 漆黒ブラック,まつ毛上,キャンメイク　シェーディングパウダー / No.01 デニッシュブラウン,顔,キャンメイク　シェーディングパウダー / No.01 デニッシュブラウン,額,キャンメイク　シェーディングパウダー / No.01 デニッシュブラウン,顎,キャンメイク　シェーディングパウダー / No.01 デニッシュブラウン,鼻,ヒロインメイク　ロング＆カールマスカラ スーパーWP / 01 漆黒ブラック,まつ毛上,M・A・C　ミネラライズ ブラッシュ / ウォームソウル,頬,[パウダー],頬,ローラ メルシエ　マットラディアンス ベイクドパウダー / １,パウダー,レブロン　スキンライト プレスト パウダー N / 104 ピュア ラベンダー,頬,レブロン　スキンライト プレスト パウダー N / 104 ピュア ラベンダー,鼻,レブロン　スキンライト プレスト パウダー N / 104 ピュア ラベンダー,瞼上,[リップ],口,[リップ],口,,,,,,,,,,,,,,,,,,,,,,,,,,,,
IEAWeT8pZ50,nanakoななこ,2021-10-07 18:00:07+00:00,【一軍コスメ】整形級の崩れず乾燥しない毎日メイク！夏秋メイク紹介するよ！プチプラ多め！【ベスコス】【2021 秋メイク】,ご視聴ありがとうございます！❤︎／ 今日のコスメ！ 値段はななこ調べです！ VT CICA マイルドトナーパッド ¥1600 espoire ...,△,espoir　WATER SPLASH CICA TONE UP CREAM,下地,マーシュ・フィールド　マーシュフィールド SC クリームファンデS / 16,瞼下,マーシュ・フィールド　マーシュフィールド SC クリームファンデS / 16,鼻,マーシュ・フィールド　マーシュフィールド SC クリームファンデS / 16,口,Fujiko（フジコ）　書き足し眉ティントSV / 02 モカブラウン,眉,ヴィセ　ヴィセ リシェ アイブロウパウダー / BR-3　（１）　〓〓〓　ヴィセ　ヴィセ リシェ アイブロウパウダー / BR-3　（２）,眉,マーシュ・フィールド　マーシュフィールド SC クリームファンデS / 16,眉,キャンメイク　シェーディングパウダー / No.05 ムーングレージュ,鼻,キャンメイク　シェーディングパウダー / No.05 ムーングレージュ,顔,Chacott COSMETICS(チャコット・コスメティクス) フィニッシングパウダー ナチュラル / 1027,パウダー,ヘビーローテーション　カラーリングアイブロウ / 03 アッシュブラウン,眉,セザンヌ　パールグロウハイライト / 01 シャンパンベージュ,鼻,セザンヌ　パールグロウハイライト / 01 シャンパンベージュ,口,セザンヌ　パールグロウハイライト / 01 シャンパンベージュ,顎,セザンヌ　パールグロウハイライト / 01 シャンパンベージュ,額,セザンヌ　ナチュラル チークN / 101 ホットピンク,頬,セザンヌ　ナチュラル チークN / 16 カシスローズ,頬,セザンヌ　ナチュラル チークN / 16 カシスローズ,鼻,セザンヌ　ナチュラル チークN / 16 カシスローズ,口,BBIA　ラストベルベットリップティント4 / 20 マチュア,口,[二重],二重,アンリシア(UNLEASHIA)　タップミーパレットデュオ / N1　（１）,瞼上,アンリシア(UNLEASHIA)　タップミーパレットデュオ / N1　（１）,瞼下,rom&nd　ベターザンパレット / 03ローズバッドガーデン　（８）,瞼上,rom&nd　ベターザンパレット / 03ローズバッドガーデン　（５）　〓〓〓　rom&nd　ベターザンパレット / 03ローズバッドガーデン　（９）,瞼上,rom&nd　ベターザンパレット / 03ローズバッドガーデン　（９）,瞼下,rom&nd　ベターザンパレット / 03ローズバッドガーデン　（８）,瞼上,rom&nd　ベターザンパレット / 03ローズバッドガーデン　（５）　〓〓〓　rom&nd　ベターザンパレット / 03ローズバッドガーデン　（９）,瞼上,rom&nd　ベターザンパレット / 03ローズバッドガーデン　（９）,瞼下,rom&nd　ベターザンパレット / 03ローズバッドガーデン　（２）,瞼下,MISSHA（ミシャ）　パーフェクト アイブロウスタイラー（R） / ライトブラウン,瞼下,rom&nd　ベターザンパレット / 03ローズバッドガーデン　（３）,瞼上,rom&nd　ベターザンパレット / 03ローズバッドガーデン　（１）,瞼上,イニスフリー　トゥインクル グリッター / 3,瞼下,rom&nd　ベターザンパレット / 03ローズバッドガーデン　（１）,瞼下,ヒロインメイク　スムースリキッドアイライナー スーパーキープ / 02 ビターブラウン,アイライン上,コージー　カービングアイラッシュカーラー,まつ毛上,コーセーコスメニエンス　カールキープマジック / クリアブラック,まつ毛上,[ホットビューラー],まつ毛上,BBIA　ラストベルベットリップティント4 / 25,口,,,,,,,,,,,,
4IUEj71azVo,Kawanishi Mikiかわにしみき,2020-10-06 21:53:33+00:00,【30歳独身女】本気で出会いをものにする秋メイク〜マスク想定で目元重点課金〜,秋メイクってなんでこんなにワクワクするんだろうか。 いつも動画を見てくれてありがとうございます！ ▽Twitter ...,〇,プリマヴィスタ　皮脂くずれ防止 化粧下地 超オイリー肌用,下地,毛穴パテ職人　毛穴崩れ防止下地,下地,ランコム　タン イドル ウルトラ クッションコンパクト / PO-03,ファンデーション,RMK　RMK ルミナス ペンブラッシュコンシーラー / 04,コンシーラー,RMK　RMK ルミナス ペンブラッシュコンシーラー / 01,コンシーラー,Perfect Diary　トランスルーシェントブルーリングルースパウダ― / 01クリア,パウダー,M・A・C　シェイピング パウダー / アクセンチュエイト,パウダー,ベアミネラル　バウンス ＆ ブラー ブラッシュ / ブラード バフ,頬,セザンヌ　ナチュラル チークN / 17 ウォームブラウン,頬,キャンメイク　ハイライター / No.L01 シャンパンゴールド,鼻,キャンメイク　ハイライター / No.L01 シャンパンゴールド,頬,VAVI MELLO(バビメロ)　スウィートプランパー,口,VAVI MELLO(バビメロ)　パーフェクトシェーディング&アイブロウ　（１）,眉,VAVI MELLO(バビメロ)　パーフェクトシェーディング&アイブロウ　（２）,眉,ヘビーローテーション　カラーリングアイブロウ マイクロ / 03 アッシュブラウン,眉,VAVI MELLO(バビメロ)　パーフェクトシェーディング&アイブロウ　（１）,鼻,VAVI MELLO(バビメロ)　4in1パーフェクトフェイスパレット　（２）,鼻,VAVI MELLO(バビメロ)　パーフェクトシェーディング&アイブロウ　（１）　〓〓〓　VAVI MELLO(バビメロ)　パーフェクトシェーディング&アイブロウ　（２）,顔,VAVI MELLO(バビメロ)　パーフェクトシェーディング&アイブロウ　（１）　〓〓〓　VAVI MELLO(バビメロ)　パーフェクトシェーディング&アイブロウ　（２）,額,ディオール　サンク クルール クチュール / 689 ミッツァ　（１）,瞼上,ディオール　サンク クルール クチュール / 689 ミッツァ　（３）,瞼上,ディオール　サンク クルール クチュール / 689 ミッツァ　（２）,瞼上,キャンメイク　ハイライター / No.L01 シャンパンゴールド,瞼上,ディオール　サンク クルール クチュール / 689 ミッツァ　（１）,瞼下,ディオール　サンク クルール クチュール / 689 ミッツァ　（５）,アイライン上,VAVI MELLO(バビメロ)　パーフェクトシェーディング&アイブロウ　（２）,瞼下,ヒロインメイク　アイラッシュカーラー N2,まつ毛上,ヒロインメイク　スムースリキッドアイライナー スーパーキープ / 02 ビターブラウン,アイライン上,ディオール　サンク クルール クチュール / 689 ミッツァ　（３）,アイライン上,エテュセ　アイエディション (ジェルライナー) / 01 バーガンディブラウン,アイライン上,イニスフリー　トゥインクル グリッター / 2,瞼下,CipiCipi　グリッターイルミネーションライナー / ？,瞼上,[マスカラ],まつ毛上,[マスカラ],まつ毛下,D-UP(ディーアップ)　パーフェクトエクステンションマスカラ for カール / ブラック,まつ毛上,D-UP(ディーアップ)　パーフェクトエクステンションマスカラ for カール / ブラック,まつ毛下,RICAFROSH　ジューシーリブティント / 01オランジェット,口,RICAFROSH　ジューシーリブティント / 01オランジェット,口,VAVI MELLO(バビメロ)　スウィートプランパー,口,RICAFROSH　ジューシーリブティント / 04クランベリー,口,,,,,,,,,,,,
