videoId,channelTitle,publishedAt,title,description,Contact,Product 1,Location 1,Product 2,Location 2,Product 3,Location 3,Product 4,Location 4,Product 5,Location 5 ,Product 6,Location 6,製品ID 7,場所 7,製品ID 8,場所 8,製品ID 9,場所 9,製品ID 10,場所 10,製品ID 11,場所 11,製品ID 12,場所 12,製品ID 13,場所 13,製品ID 14,場所 14,製品ID 15,場所 15,製品ID 16,場所 16,製品ID 17,場所 17,製品ID 18,場所 18,製品ID 19,場所 19,製品ID 20,場所 20,製品ID 21,場所 21,製品ID 22,場所 22,製品ID 23,場所 23,製品ID 24,場所 24,製品ID 25,場所 25,製品ID 26,場所 26,製品ID 27,場所 27,製品ID 28,場所 28,製品ID 29,場所 29,製品ID 30,場所 30,製品ID 31,場所 31,製品ID 32,場所 32,製品ID 33,場所 33,製品ID 34,場所 34,製品ID 35,場所 35,製品ID 36,場所 36,製品ID 37,場所 37,製品ID 38,場所 38,製品ID 39,場所 39,製品ID 40,場所 40,製品ID 41,場所 41,製品ID 42,場所 42,製品ID 43,場所 43,製品ID 44,場所 44,製品ID 45,場所 45,製品ID 46,場所 46
BaE66NDZag4,Sakura Miyawaki,2021-07-10 20:00:04+00:00,(ENG/KOR Sub)どんなに泣いても崩れない最強アイドルメイク | Guide to Sakura Miyawaki’s Idol Makeup that will never come off,宮脇咲良 HKT48 卒業コンサート ～Bouquet～」の時のメイクをご紹介します。 私がいつも持ち歩いているメイクポーチの中身も ...,なし,courcelles ポアプライマー,下地,courcelles base original,下地,JUNGSAEMMOOL　スキン セッティング トーンアップ サン ベース,下地,GIVERNY　密着カバーファンデーション / 17 ポスリン　〓〓〓　espoir　プロテーラーファンデーション ビーグロウ,ファンデーション,LUNA　ロングラスティング チップ コンシーラー / 01 バニラ,コンシーラー,イニスフリー　ノーセバム ミネラルパウダー N,パウダー,WHOMEE　アイブロウパウダー / N bright brown　（１）　〓〓〓　WHOMEE　アイブロウパウダー / N bright brown　（２）,眉,ドーリーウインク　アイブロウフィルター / 01 ピンクベージュ,眉,CLIO　プロ アイ パレット / 1号 シンプリーピンク　（１）　〓〓〓　プロ アイ パレット / 1号 シンプリーピンク　（６）,瞼上,CLIO　プロ アイ パレット / 1号 シンプリーピンク　（１）　〓〓〓　プロ アイ パレット / 1号 シンプリーピンク　（６）,瞼下,CLIO　プロ アイ パレット / 1号 シンプリーピンク　（５）　〓〓〓　プロ アイ パレット / 1号 シンプリーピンク　（９）,瞼上,CLIO　プロ アイ パレット / 1号 シンプリーピンク　（５）　〓〓〓　プロ アイ パレット / 1号 シンプリーピンク　（９）,瞼下,PICCASSO　プロエイトチョンダム ステイオン ジェルアイライナー / 02 ダークブラウン,アイライン上,CLIO　プロ アイ パレット / 1号 シンプリーピンク　(１０),アイライン上,THE TOOL LAB　ザスタイルラッシュ,まつ毛上,エチュード　ラッシュパーム ボリュームフィックスマスカラ / ブラウン,まつ毛上,竹串,まつ毛上,CLIO　プロ アイ パレット / 1号 シンプリーピンク　（５）　〓〓〓　プロ アイ パレット / 1号 シンプリーピンク　（９）　〓〓〓　プロ アイ パレット / 1号 シンプリーピンク　（１０）,瞼下,FORENCOS 　ベアシャドウパレット / 09BOUQUET（ブーケ）　（１）,瞼上,FORENCOS 　ベアシャドウパレット / 09BOUQUET（ブーケ）　（１）,瞼下,colorgram　ミルクブリング シャドウ / 01 ダブルスター,瞼上,colorgram　ミルクブリング シャドウ / 01 ダブルスター,瞼下,エチュード　ラッシュパーム ボリュームフィックスマスカラ / ブラウン,まつ毛下,rom&nd　 ベターザンチーク / #03 ブルーベリーチップ,チーク,A’pieu（アピュー）　パステルブラッシャー / PK07,チーク,？,鼻,モアリップ　モアリップ N (医薬品),口,peripera　インクエアリーベルベット / 14 ロージーピンク,口,rom&nd ジューシーラスティングティント / 15 FUNKY MELON,口,,,,,,,,,,,,,,,,,,,,,,,,,,,,,,,,,,
pCfy_W-bVZk,ハウスダスト,2023-07-22 22:32:35+00:00,イメージはいちごミルク?!🍓🥛”韓国から見た地雷メイク”が可愛すぎる😭💗加工したみたいに盛れるメイクが出来たのでみんなにシェアさせてください‼️‼️‼️,担保の使い方間違ってないか！？！？！？！ ▽サブチャンはこちら https://youtube.com/@DustBakudan ▽ファンレター・ ...,ベイビーモテコン / #ベイビーベイビー,CandyDoll(キャンディドール)　ブライトピュアベースCC / フィルターホワイト,下地,TIRTIR　MASK FIT MAKE-UP FIXER,化粧水,CandyDoll(キャンディドール) 　ブライトピュアベースCC / ラベンダー,下地,SHEGLAM　マルチフィックスコンシーラー&カラーコレクター / Vanilla　（３）,眉,VT(ブイティー)　CICA ノーセバム マイルドパウダー,眉,LANEIGE(ラネージュ) ネオ クッション グロウ / 21C クールベージュ,ファンデーション,LUNA　ロングラスティングチップ コンシーラー / 0.7 アイボリー,コンシーラー,セザンヌ　うるふわ仕上げパウダー / 03 ルーセントクリア,パウダー,キャンメイク　ラスティングマルチアイベース WP / 02 クリームイエロー,瞼上,CLIO　プロ アイ パレット / 014 アトリエ イン ハンナム　（２）,瞼上,CLIO　プロ アイ パレット / 014 アトリエ イン ハンナム　（２）,瞼下,CLIO　プロ アイ パレット / 014 アトリエ イン ハンナム　（３）,瞼上,和粧　麻雀アイシャドウ / 九筒・リッチマホガニー,アイライン上,和粧　麻雀アイシャドウ / 九筒・リッチマホガニー,瞼上,和粧　麻雀アイシャドウ / 九筒・リッチマホガニー,アイライン下,和粧　麻雀アイシャドウ / 九筒・リッチマホガニー,瞼下,CLIO　プロ アイ パレット / 014 アトリエ イン ハンナム　（３）,瞼下,the SAEM　カバーパーフェクションコンシーラーペンシル / #1.0 クリアベージュ,瞼下,Joocyee　チップコンシーラー / 01,瞼下,JUDYDOLL　メリハリマスターパレット / ＃０２ウォームトーン （４）,瞼下,CLIO　プロ アイ パレット / 014 アトリエ イン ハンナム　（３）,瞼下,CLIO　プロ アイ パレット / 014 アトリエ イン ハンナム　（６）,瞼上,Judydoll　スリムリキッドアイライナー / #01 ブラック,アイライン上,FOCALLURE　フェアリーグリッターライナー / S01 フェアリーダイヤモンド,瞼下,アイプチ　ひとえ・奥ぶたえ用カーラー,まつ毛上,ケイト　ラッシュマキシマイザーHP ,まつ毛上,ペリペラ　インクブラック カラ(AD)-ロングラッシュカーリング / 1,まつ毛上,ケイト　デザイニングアイブロウ3D / EX-7　（？）,眉,JUDYDOLL　メリハリマスターパレット / ＃０１クールトーン （３）,顎,JUDYDOLL　メリハリマスターパレット / ＃０１クールトーン （３）,顔,JUDYDOLL　メリハリマスターパレット / ＃０１クールトーン （２）,鼻,JUDYDOLL　メリハリマスターパレット / ＃０１クールトーン （４）,鼻,aZTK　シングルカラーチーク / 06ラベンダードリーム,頬,peripera　ブラッシュド サンシャイン チーク / 06 朝寝坊だいすき,頬,セザンヌ　うるふわ仕上げパウダー / 01 ルーセントベージュ,パウダー,JUDYDOLL　メリハリマスターパレット / ＃０１クールトーン （１）,頬,JUDYDOLL　メリハリマスターパレット / ＃０１クールトーン （１）,口,JUDYDOLL　メリハリマスターパレット / ＃０１クールトーン （１）,顎,AND SPACE　ほくろメイク ポイントリキッドA,ほくろ,FLORTTE　キュート シングス スーパーマーケット マットリップ / #01 草莓绯闻,口,LUNA　ロングラスティングチップ コンシーラー / 0.7 アイボリー,口,peripera　ブラッシュド サンシャイン チーク / 06 朝寝坊だいすき,口,CLIO　デューイブラーティント / 04 サイレント ワイン,口,,,,,,
xr2TSA0dvCg,五彩緋夏 ひなちゃん5しゃい,44993.20347,韓国JKメイクが無彩色でたまらん可愛い,,MOLAK　DAZZLEGRAY,Wonjungyo　ウォンジョンヨ トーンアップベース / 02 ライムイエロー,下地,Perfect Diary　フローレスクッションファンデーション / B01 アイボリーホワイト（暖色系）,ファンデーション,TIRTIR　MASK FIT ALL-COVER DUAL CONCEALER / 01 ナチュラル,コンシーラー,花西子　玉女桃花エアフェイスパウダー / 03 透明マット,下地,rom&nd ベターザンパレット / 04ダスティフォグガーデン　（８）,瞼上,rom&nd ベターザンパレット / 04ダスティフォグガーデン　（６）　〓〓〓　rom&nd ベターザンパレット / 04ダスティフォグガーデン　（７）,瞼上,rom&nd ベターザンパレット / 04ダスティフォグガーデン　（８）,瞼下,rom&nd ベターザンパレット / 04ダスティフォグガーデン　（９）,瞼下,rom&nd ベターザンパレット / 04ダスティフォグガーデン　（９）　〓〓〓　rom&nd ベターザンパレット / 04ダスティフォグガーデン　（１０）,アイライン上,rom&nd ベターザンパレット / 04ダスティフォグガーデン　（３）,瞼下,キャンメイク　アイバッグコンシーラー / 01 イエローベージュ,瞼下,TIRTIR　EDGE SLIM LIQUID EYELINER / 01 DEEPBLACK,アイライン上,資生堂　アイラッシュカーラー 213,まつ毛上,Wonjungyo　ウォンジョンヨ ヌードアイラッシュ / 01 シアーブラック,まつ毛上,Wonjungyo　ウォンジョンヨ ヌードアイラッシュ / 01 シアーブラック,まつ毛下,Rom&nd ベターザンパレット / 04ダスティフォグガーデン　（９）,アイライン上,ケイト　デザイニングライナー,まつ毛下,CipiCipi　ポイントコンシーラー,瞼下,Flynn　ミニヌーディーエディション / （３）,アイライン上,Flynn　ミニヌーディーエディション / （３）,瞼下,rom&nd ベターザンパレット / 04ダスティフォグガーデン　（９）,眉,rom&nd　ベターザンチーク / W02 Strawberry Milk,チーク,coou　シェーディング / （１）,鼻,coou　シェーディング / （２）,鼻,ZEESEA　大英博物館 エンジェルキューピッドキスハイライター / S02 ダイヤモンドシャンパン,鼻,b idol　1moreペンシルR リップシェイプ / 01 リップシェイプ(ピンク),口,i’m meme(アイムミミ)　ミステリーブラ―ティント / 005・ミステリープラム,口,rom&nd ベターザンパレット /  04ダスティフォグガーデン　（４）,口,ZEESEA　大英博物館 エンジェルキューピッドキスハイライター / S02 ダイヤモンドシャンパン,口,peripera　インク ムード ドロップ ティント,口,無印良品　リップライナー / ピーチベージュ,口,SHEGLAM　Jelly Wow Hydrating Lip Oil / Grapefruit Glow,口,AND SPACE　ほくろメイク ポイントリキッドA,ほくろ,,,,,,,,,,,,,,,,,,,,,,,,,,
oAQbRphtesE,ハウスダスト,44900.20903,初めて韓国メイクしたら整形級に盛れた????日本顔と韓国顔の違いは？似せる方法を徹底解説??加工方法も教えます??,みんないつもありがとう！ ▽ファンレター・プレゼント宛先 動画や各SNSで紹介させていただくことがあります！ いつも ...,Candy Magic Marble　チェルシー,CandyDoll(キャンディドール)　ブライトピュアベースCC＜ブルー＞,下地,CathyDoll(キャシードール)　ヌードマットブラッシャー / 09 Win My Heart,眉,CathyDoll(キャシードール)　ヌードマットブラッシャー / 09 Win My Heart,チーク,TIRTIR　MASK FIT RED CUSHION / 17C PORCELAIN　〓〓〓　コーセーコスメニエンス　メイク キープ ミスト EX MOIST,ファンデーション,TIRTIR　MASK FIT ALL-COVER DUAL CONCEALER / 01 ナチュラル,コンシーラー,キャンメイク　カラーミキシングコンシーラー / No.01 ライトベージュ　（３）,眉,TIRTIR　MASK FIT ALL-COVER DUAL CONCEALER / 01 ナチュラル,コンシーラー,コーセーコスメニエンス　メイク キープ ミスト EX MOIST,化粧水,キャンメイク　マシュマロフィニッシュパウダー / ML マットライトオークル,パウダー,キャンメイク　シェーディングパウダー / No.04 アイスグレーブラウン,鼻,キャンメイク　シェーディングパウダー / No.04 アイスグレーブラウン,顔,キャンメイク　ラスティングマルチアイベース WP / 02 クリームイエロー,瞼上,BBIA　ファイナルシャドウパレット / 07メレンゲ　（３）,瞼上,BBIA　ファイナルシャドウパレット / 07メレンゲ　（７）,瞼上,BBIA　ファイナルシャドウパレット / 07メレンゲ　（７）,瞼下,BBIA　ファイナルシャドウパレット / 07メレンゲ　（８）,アイライン上,BBIA　ファイナルシャドウパレット / 07メレンゲ　（８）,アイライン下,BBIA　ファイナルシャドウパレット / 07メレンゲ　（８）,アイライン上,BBIA　ファイナルシャドウパレット / 07メレンゲ　（８）,アイライン下,BBIA　ファイナルシャドウパレット / 07メレンゲ　（８）,瞼上,BBIA　ファイナルシャドウパレット / 07メレンゲ　（８）,瞼下,the SAEM　カバーパーフェクションコンシーラーペンシル / 1.0 クリアベージュ,瞼下,キャンメイク　マシュマロフィニッシュパウダー / ML マットライトオークル,瞼下,セザンヌ　極細アイライナー EX / 10 ブラック,アイライン上,アイプチ　ひとえ・奥ぶたえ用カーラー,まつ毛上,ケイト　ラッシュマキシマイザーHP,まつ毛上,ヒロインメイク　ボリューム＆カールマスカラ スーパーWP / 01 漆黒ブラック,まつ毛上,キャンメイク　クリーミータッチライナー / No.01 ディープブラック,アイライン上,BBIA　ファイナルシャドウパレット / 07メレンゲ　（７）,眉,BBIA　ファイナルシャドウパレット / 07メレンゲ　（８）,眉,キャンメイク　マシュマロフィニッシュパウダー / ML マットライトオークル,鼻,キャンメイク　シェーディングパウダー / No.04 アイスグレーブラウン,鼻,TIRTIR　MASK FIT RED CUSHION / 17C PORCELAIN,口,キャンメイク　クリーミータッチライナー / 09 ダージリンピンク,口,キャンメイク　シェーディングパウダー / No.04 アイスグレーブラウン,口,rom&nd　ゼロベルベットティント Baked Velvet / #14 ピーカンタルト,口,INTO U　スーパーマットリップ＆チークマッド / EM04 女神ブルーベリー,口,TIRTIR　MASK FIT RED CUSHION / 17C PORCELAIN,口,INTO U　スーパーマットリップ＆チークマッド / EM04 女神ブルーベリー,チーク,rom&nd　ベターザンチーク/ #W01 オディミルク,チーク,,,,,,,,,,,,
XCnqQbhjJs0,ふくれな/fukurena,45027.20833,【蛙化現象】韓国風メイクしながらシビアな恋愛相談コーナー????,いつもご視聴ありがとうございます！ プロデュースコスメ CipiCipi 【web】https://cipicipi.jp/ ...,オーレンズ　アイライターグローイワンデー / ブラック,イヴ・サンローラン　トップ シークレット インスタント トーンアップ / ラベンダー,下地,CipiCipi　リッププランパーピリカラ,口,CipiCipi　シピシピ フィットスキンクッション / ？,ファンデーション,dasique　プロコンシーラーパレット　（１）　〓〓〓　dasique　プロコンシーラーパレット　（７）,コンシーラー,muice　ヨレンパウダー ツヤカバー,パウダー,dasique　Vカットブレンディングシェーディング　（１）　〓〓〓　dasique　Vカットブレンディングシェーディング　（２）　〓〓〓　dasique　Vカットブレンディングシェーディング　（３）,顔,CipiCipi　ブロウパウダー / 01 オールブラウン　（２）,眉,セザンヌ　超細芯アイブロウ / 02 オリーブブラウン,眉,トム フォード　ビューティ エモーションプルーフ アイ プライマー,瞼上,dasique　シャドウパレット / 18 Berry Smoothie　（６）,瞼上,dasique　シャドウパレット / 18 Berry Smoothie　（７）　〓〓〓　dasique　シャドウパレット / 18 Berry Smoothie　（８）,瞼上,CipiCipi　ポイントコンシーラー / ライトベージュ,瞼下,dasique　シャドウパレット / 18 Berry Smoothie　（６）,瞼下,CipiCipi　シークレットキワミライナーR,瞼下,dasique　シャドウパレット / 18 Berry Smoothie　（１４）,瞼下,dasique　シャドウパレット / 18 Berry Smoothie　（１４）,アイライン下,colorgram　colorgram アーティストF クリームライナー / 06 コーラルブラウン,アイライン下,dasique　スリムジェルアイライナー / #02 Pearl Brown,アイライン上,dasique　シャドウパレット / 18 Berry Smoothie　（１８）,アイライン上,dasique　シャドウパレット / 18 Berry Smoothie　（１８）,アイライン下,dasique　シャドウパレット / 18 Berry Smoothie　（１２）,瞼上,dasique　シャドウパレット / 18 Berry Smoothie　（１４）,瞼上,[ビューラー],まつ毛上,Wonjungyo　ウォンジョンヨ ヌードアイラッシュ / ？,まつ毛上,EYEME　カッティングアイラッシュ / V33,まつ毛上,Wonjungyo ウォンジョンヨ ダイヤモンドライナー / ？,瞼下,fwee(フィー)　フィーチークメロウ / 03 ハイキーハピネス,頬,ネイミング　フラッフィパウダーチーク / ヤミー,頬,fwee(フィー)　フィーチークメロウ / 04 ダイヤ１カラット,頬,fwee(フィー)　フィーチークメロウ / 04 ダイヤ１カラット,眉,fwee(フィー)　フィーチークメロウ / 04 ダイヤ１カラット,額,fwee(フィー)　フィーチークメロウ / 04 ダイヤ１カラット,鼻,fwee(フィー)　フィーチークメロウ / 04 ダイヤ１カラット,瞼上,Heart Percent　ドット オン ムード リップペンシル マット,口,Heart Percent　ドット オン ムード リップペンシル マット,鼻,espoir　ザスリックリップスティッククリームマット / フォージ―,口,CipiCipi　ふわマットティント / 03 いちごチャイ,口,,,,,,,,,,,,,,,,,,
cf-PtMK0qGU,五彩緋夏 ひなちゃん5しゃい,45115.20833,白みピンクな&quot;韓国ガーリーメイク&quot;が今アツい?,提供：TIRTIR TIRTIRの人気新作クッション！ 【MASK FIT AURA CUSHION】 →オフライン限定商品 そして、オンラインの人気 ...,オーレンズ　アイライターグローイワンデー / ブラウン,ヴィセ　ヴィセ リシェ トーンアップ プライマー,下地,TIRTIR　MASK FIT AURA CUSHION / ？,ファンデーション,ディオール　ディオールスキン フォーエヴァー スキン コレクト コンシーラー / 0Nニュートラル,コンシーラー,キャンメイク　プランぷくコーデアイズ / 02 サクラプランぷく　（１）,瞼上,キャンメイク　プランぷくコーデアイズ / 02 サクラプランぷく　（４）,瞼上,キャンメイク　プランぷくコーデアイズ / 02 サクラプランぷく　（２）,瞼上,Armuje　ジュエルアイカラーコレクション / ローズクォーツの純愛　（？）,瞼下,キャンメイク　クリームチーク(マットタイプ) / M03・マカロンフレーズ,頬,[パウダー],パウダー,キャンメイク　パーフェクトマルチアイズ / 04・クラシックピンク　（５）,アイライン下,キャンメイク　パーフェクトマルチアイズ / 04・クラシックピンク　（５）,アイライン上,キャンメイク　パーフェクトマルチアイズ / 04・クラシックピンク　（２）　〓〓〓　キャンメイク　パーフェクトマルチアイズ / 04・クラシックピンク　（４）,瞼下,キャンメイク　3wayスリムアイルージュライナー / 03 アイシーピンク,瞼下,キャンメイク　プランぷくコーデアイズ / 02 サクラプランぷく　（３）,瞼下,キャンメイク　プランぷくコーデアイズ / 02 サクラプランぷく　（２）,瞼下,セザンヌ　極細アイライナー EX / 10 ブラック,アイライン上,Armuje　ジュエルアイカラーコレクション / ローズクォーツの純愛　（２）,瞼上,資生堂　アイラッシュカーラー 213,まつ毛上,TIRTIR　セルフィーメーカーデュオマスカラ,まつ毛上,アイプチ　アイプチ リキッドテープN,まつ毛下,Armuje　ジュエルアイカラーコレクション / ローズクォーツの純愛　（２）,瞼下,キャンメイク　パーフェクトマルチアイズ / 04・クラシックピンク　（５）,眉,セザンヌ　トーンアップアイシャドウ / 03 チャコールブラウン　（３）,眉,Armuje　マットジュエルリップコレクション / モルガナイトの魔法,口,Armuje　ジュエルアイカラーコレクション / ローズクォーツの純愛　（４）,口,キャンメイク　パーフェクトマルチアイズ / 04・クラシックピンク　（２）,口,TIRTIR　マイグローリップオイル / HONEY,口,[シェーディング],鼻,[シェーディング],顎,Armuje　ジュエルアイカラーコレクション / ローズクォーツの純愛　（２）,鼻,muice　うるみハイライター / 02 サクラヴェール,鼻,muice　うるみハイライター / 02 サクラヴェール,口,muice　うるみハイライター / 02 サクラヴェール,瞼上,,,,,,,,,,,,,,,,,,,,,,,,,,
2tRd_c9rQiE,ふくれな/fukurena,2018-12-14 19:00:00+00:00,【今の韓国メイク】すっぴんドブ女が韓国コスメだけでフルメイクしてみた！！！,いつもご視聴ありがとうございます！ 【お仕事ご依頼】 emurena.info@guild-inc.tokyo 【お手紙などこちら】 〒107-0062『 ...,CHUING　3CON GRAY,エチュード ニンフオーラボリューマー,下地,MISSHA（ミシャ）　グロウ テンション / ？,ファンデーション,the SAEM　CPチップコンシーラー / ？,コンシーラー,3CE　アイブロウキット （１）,眉,3CE　スタジオ カラーリングブラウン ペンシル＆マスカラ,眉,A'PIEU(海外) スキニーブローカラー,眉,3CE　アイブロウキット （１）,鼻,[アイシャドウパレット],瞼上,[二重],二重,[アイシャドウパレット],瞼上,[アイシャドウパレット],瞼上,[アイシャドウパレット],瞼上,[アイシャドウパレット],瞼下,[アイシャドウパレット],瞼下,エチュード ミラーホリック リキッドアイズ / ピンクオーナメント,瞼下,3CE　アイブロウキット （１）,瞼下,[ビューラー],まつ毛上,[マスカラ],まつ毛上,[アイシャドウパレット],頬,[アイシャドウパレット],頬,[アイシャドウパレット],顔,[アイシャドウパレット],顎,[アイシャドウパレット],額,[マスカラ],まつ毛上,[マスカラ],まつ毛下,CLIO　シャープ ソ シンプル ウォータープルーフ ペンシル ライナー / 003 CACAO BROWN,アイライン上,[リップ],口,3CE　レッドレシピ リップカラー,口,,,,,,,,,,,,,,,,,,,,,,,,,,,,,,,,,,,,
