videoId,channelTitle,publishedAt,title,description,Contact,Product 1,Location 1,Product 2,Location 2,Product 3,Location 3,Product 4,Location 4,Product 5,Location 5 ,Product 6,Location 6,製品ID 7,場所 7,製品ID 8,場所 8,製品ID 9,場所 9,製品ID 10,場所 10,製品ID 11,場所 11,製品ID 12,場所 12,製品ID 13,場所 13,製品ID 14,場所 14,製品ID 15,場所 15,製品ID 16,場所 16,製品ID 17,場所 17,製品ID 18,場所 18,製品ID 19,場所 19,製品ID 20,場所 20,製品ID 21,場所 21,製品ID 22,場所 22,製品ID 23,場所 23,製品ID 24,場所 24,製品ID 25,場所 25,製品ID 26,場所 26,製品ID 27,場所 27,製品ID 28,場所 28,製品ID 29,場所 29,製品ID 30,場所 30,製品ID 31,場所 31,製品ID 32,場所 32,製品ID 33,場所 33,製品ID 34,場所 34,製品ID 35,場所 35,製品ID 36,場所 36,製品ID 37,場所 37,製品ID 38,場所 38,製品ID 39,場所 39,製品ID 40,場所 40,製品ID 41,場所 41,製品ID 42,場所 42,製品ID 43,場所 43,製品ID 44,場所 44,製品ID 45,場所 45,製品ID 46,場所 46
xOKPwUUAkYY,Zerona ASMR제로나,2021-12-28 22:21:48+00:00,UC0D9ASWn4HNR_nkpFT7Gzhg,日本語ASMR 授業時間に友達からのメイクアップロールプレイ💄✨학교 친구 메이크업 메이크업 해주기 상황극 Make-up Roleplay,こんにちは、皆さん:) ゼロナです！ 今日は この前に(結構昔)購読者の方が リクエストしてくださった！ 学校の友達とメイク  して ...,×,,,,,,,,,,,,,,,,,,,,,,,,,,,,,,,,,,,,,,,,,,,,,,,,,,,,,,,,,,,,,,,,,,,,,,,,,,,,,,,,,,,,,,,,,,,
EVq-TbpK9r8,Kawanishi Mikiかわにしみき,2022-10-02 20:00:16+00:00,UCgpq8b6bCzkSLquNQeSE6QQ,【大変身】TWICEのメイクさんに韓国アイドルメイクしてもらったら感動が止まらない…😭✨【メイク術に圧巻】,初っ端の안녕하세요のスペル間違えてて鬼恥ずかしい。すみません。。 今回は韓国の有名なメイクさんのウォン・ジョンヨ先生に ...,△,,,,,,,,,,,,,,,,,,,,,,,,,,,,,,,,,,,,,,,,,,,,,,,,,,,,,,,,,,,,,,,,,,,,,,,,,,,,,,,,,,,,,,,,,,,
C4U4DY0OFl4,nanakoななこ,2022-09-20 00:46:37+00:00,UC3swo6utVXOSYwxazwoKWBQ,【黒髪優勝】簡単なのに究極にかわいいあざとい純欲メイク！！イエベもブルベも！！うるうる透明感の出し方【プチプラコスメ】,家族のことでちょっとバタバタしていて、久しぶりの更新になってしまいました。 今日からまた投稿頑張るのでよろしくね   \ご ...,×,,,,,,,,,,,,,,,,,,,,,,,,,,,,,,,,,,,,,,,,,,,,,,,,,,,,,,,,,,,,,,,,,,,,,,,,,,,,,,,,,,,,,,,,,,,
979UXsyuwkA,水越みさと,2022-07-22 19:00:10+00:00,UCffg7iYU2K7HFJDhylZzUBw,【最新版クッションファンデ比較】人気20種類徹底比較！韓国&amp;デパコス&amp;プチプラ比較◎崩れにくい・ツヤ肌・カバー力徹底検証　#ベースメイク,みなさんこんにちは。 水越みさとです。 本日はクッションファンデ比較やっていきたいと思います！ カバー力、艶？マット？,×,,,,,,,,,,,,,,,,,,,,,,,,,,,,,,,,,,,,,,,,,,,,,,,,,,,,,,,,,,,,,,,,,,,,,,,,,,,,,,,,,,,,,,,,,,,
C4U4DY0OFl4,nanakoななこ,2022-09-20 00:46:37+00:00,UC3swo6utVXOSYwxazwoKWBQ,【黒髪優勝】簡単なのに究極にかわいいあざとい純欲メイク！！イエベもブルベも！！うるうる透明感の出し方【プチプラコスメ】,家族のことでちょっとバタバタしていて、久しぶりの更新になってしまいました。 今日からまた投稿頑張るのでよろしくね   \ご ...,×,,,,,,,,,,,,,,,,,,,,,,,,,,,,,,,,,,,,,,,,,,,,,,,,,,,,,,,,,,,,,,,,,,,,,,,,,,,,,,,,,,,,,,,,,,,
979UXsyuwkA,水越みさと,2022-07-22 19:00:10+00:00,UCffg7iYU2K7HFJDhylZzUBw,【最新版クッションファンデ比較】人気20種類徹底比較！韓国&amp;デパコス&amp;プチプラ比較◎崩れにくい・ツヤ肌・カバー力徹底検証　#ベースメイク,みなさんこんにちは。 水越みさとです。 本日はクッションファンデ比較やっていきたいと思います！ カバー力、艶？マット？,×,,,,,,,,,,,,,,,,,,,,,,,,,,,,,,,,,,,,,,,,,,,,,,,,,,,,,,,,,,,,,,,,,,,,,,,,,,,,,,,,,,,,,,,,,,,
6joqzhJOH0s,水越みさと,2020-05-23 20:30:00+00:00,UCffg7iYU2K7HFJDhylZzUBw,【ベースメイク】クッションファンデ20種類徹底比較！【韓国コスメ編】崩れにくいおすすめは？カバー力は？ツヤ肌セミマット肌それぞれ紹介！,blog https://misatomakeup.com/ デパコス編はこちら：https://youtu.be/Dxnd1TAmIR8 お待たせしました！ クッションファンデ ...,×,,,,,,,,,,,,,,,,,,,,,,,,,,,,,,,,,,,,,,,,,,,,,,,,,,,,,,,,,,,,,,,,,,,,,,,,,,,,,,,,,,,,,,,,,,,
dVfesJbhtLs,ハウスダスト,2023-08-09 21:00:56+00:00,UCFU_oYKmxNI_8mYNQMhmLvA,【化ける】1年中化粧しない日がないダストの”技術集結”毎日メイク😎✨ベースからリップまで手を抜かない,お待たせしますた   いつも動画自体ギリギリだから概要欄は遅刻です…泣 なんかちょっとまじめな感じになりそうだったから概要 ...,×,,,,,,,,,,,,,,,,,,,,,,,,,,,,,,,,,,,,,,,,,,,,,,,,,,,,,,,,,,,,,,,,,,,,,,,,,,,,,,,,,,,,,,,,,,,
E0mxQbSf8N8,エミリンチャンネル,2023-02-26 19:00:07+00:00,UCq3YtFr5JWvID4iK9HyrM3Q,憧れのプロメイクさんに純欲メイクを教えてもらったけど出来なさすぎて絶望【小田切ヒロさん】,小田切ヒロさん 本当にありがとうございました！ 小田切さんのチャンネルでは なんと！わたしが本気でなりたい 憧れの ...,×,,,,,,,,,,,,,,,,,,,,,,,,,,,,,,,,,,,,,,,,,,,,,,,,,,,,,,,,,,,,,,,,,,,,,,,,,,,,,,,,,,,,,,,,,,,
GrnjHRi4Jvc,NOBLEMAN【ノーブルマン】,2018-08-08 02:12:38+00:00,UCSHc05m3seGiDBH6ZChd1xA,【妹流】韓国オルチャンメイク♡【初ソロ動画】,アニョハセヨ〜ゆうて以前より沢山リクエスト頂いてました、妹サラのメイク動画。韓国に帰った時撮影して来ましたのでご覧 ...,,,,,,,,,,,,,,,,,,,,,,,,,,,,,,,,,,,,,,,,,,,,,,,,,,,,,,,,,,,,,,,,,,,,,,,,,,,,,,,,,,,,,,,,,,,,
Y6b9mKwiijg,エミリンチャンネル,2019-12-13 21:00:09+00:00,UCq3YtFr5JWvID4iK9HyrM3Q,K-POPアイドルに憧れて韓国風メイクをしてみたらちょっと盛れた。,タナカガ（パパラピーズ） https://www.youtube.com/channel/UCwN4CR-bDM9ZjvPhb44AfxQ 個人チャンネルも最近はじめ ...,,,,,,,,,,,,,,,,,,,,,,,,,,,,,,,,,,,,,,,,,,,,,,,,,,,,,,,,,,,,,,,,,,,,,,,,,,,,,,,,,,,,,,,,,,,,
