videoId,channelTitle,publishedAt,title,description,Contact,Product 1,Location 1,Product 2,Location 2,Product 3,Location 3,Product 4,Location 4,Product 5,Location 5 ,Product 6,Location 6,製品ID 7,場所 7,製品ID 8,場所 8,製品ID 9,場所 9,製品ID 10,場所 10,製品ID 11,場所 11,製品ID 12,場所 12,製品ID 13,場所 13,製品ID 14,場所 14,製品ID 15,場所 15,製品ID 16,場所 16,製品ID 17,場所 17,製品ID 18,場所 18,製品ID 19,場所 19,製品ID 20,場所 20,製品ID 21,場所 21,製品ID 22,場所 22,製品ID 23,場所 23,製品ID 24,場所 24,製品ID 25,場所 25,製品ID 26,場所 26,製品ID 27,場所 27,製品ID 28,場所 28,製品ID 29,場所 29,製品ID 30,場所 30,製品ID 31,場所 31,製品ID 32,場所 32,製品ID 33,場所 33,製品ID 34,場所 34,製品ID 35,場所 35,製品ID 36,場所 36,製品ID 37,場所 37,製品ID 38,場所 38,製品ID 39,場所 39,製品ID 40,場所 40,製品ID 41,場所 41,製品ID 42,場所 42,製品ID 43,場所 43,製品ID 44,場所 44,製品ID 45,場所 45,製品ID 46,場所 46
MsrEqWpa4Lw,egg Channel,2018-06-07 17:00:03+00:00,【男ウケ抜群】清潔感のある【白ギャルメイク】これで彼氏をGETして??（make up）,WEB版egg       https://eggegg.jp/ 〈出演者情報〉 もも インスタ https://www.instagram.com/__peachstagram__/?hl=ja もも ...,〇,エポラーシェ　カラーUV＆ベース 45g,Base,レブロン　カラーステイ ロングウェア メイクアップ / 150,Foundation,毛穴パテ職人　フェイスパウダー / クリア,Powder,ケイト　デザイニングアイブロウ3D / EX-4　（１）　〓〓〓　ケイト　デザイニングアイブロウ3D / EX-4　（２）,Brow,エンジェルハート　トリプルインアイブロウ / 01 モカブラウン,Brow,ヘビーローテーション　カラーリングアイブロウ / 04 ナチュラルブラウン,Brow,セザンヌ　ノーズ＆アイブロウパウダー / 01キャメル　（２）,Nose,CandyDoll(キャンディドール)　3Dハイライト / クリームベージュ,Nose,CandyDoll(キャンディドール)　3Dハイライト / クリームベージュ,Brow,キャンメイク　アイシャドウベース / SB スキンベージュ,UpperEyelid,ケイト ブラウンシェードアイズN / BR-12　（２）,UpperEyelid,ケイト ブラウンシェードアイズN / BR-12　（１）,UpperEyelid,アナ スイ　コスメティックス カラー ケース,LowerEyelid,エンジェルハート　トリプルインアイブロウ / 01 モカブラウン,LowerEyelid,ケイト ブラウンシェードアイズN / BR-12　（３）,LowerEyelid,ティアラガール　チャーミングブラックアイライナー,UpperEyeline,D-UP(ディーアップ)　アイラッシュフィクサーEX552,DoubuleEyelid,[つけまつげ],UpperEyelash,キャンメイク　グロウフルールチークス / No.03 フェアリーオレンジフルール,Cheek,Witch's Pouch(ウィッチズポーチ)　グロススティックティントバーム / 05 アップル,Lip,,,,,,,,,,,,,,,,,,,,,,,,,,,,,,,,,,,,,,,,,,,,,,,,,,,,
#NAME?,ハウスダスト,45140.27708,【整形級】うわぁ????さすがに可愛すぎ…平たい顔族が海外ギャルメイクで無双する??後半特に重要です??,2回連続メイク動画でごめんね     マック    からメイク動画ができるなんて思ってなかったんだけど撮影しててすごく楽しかっ ...,Moonzi　green,CandyDoll(キャンディドール)　ブライトピュアベースCC / ミント,Base,SHEGLAM　マルチフィックスコンシーラー&カラーコレクター　Vanilla　（?）,Brow,VT(ブイティー)　CICA ノーセバム マイルドパウダー,Powder,TIRTIR　MASK FIT RED CUSHION / 17C PORCELAIN,Foundation,TIRTIR　MASK FIT ALL-COVER DUAL CONCEALER / 01 ナチュラル,Concealer,キャンメイク　マシュマロフィニッシュパウダー / ML マットライトオークル,Powder,[アイシャドウパレット],UpperEyelid,[アイシャドウパレット],LowerEyelid,[アイシャドウパレット],UpperEyelid,[アイシャドウパレット],LowerEyelid,[アイシャドウパレット],UpperEyeline,[アイシャドウパレット],LowerEyeline,[アイシャドウパレット],LowerEyelid,[アイシャドウパレット],UpperEyelid,キャンメイク　クリーミータッチライナー / No.03 ダークブラウン,UpperEyeline,MustaeV　スポット イレーザ コンシーラー ペンシル,LowerEyelid,キャンメイク　クリーミータッチライナー / No.03 ダークブラウン,LowerEyeline,jill leen.　ジルリーン スターグリッターライナー / A2 ロゼヴァーゴ,LowerEyelid,jill leen.　ジルリーン スターグリッターライナー / A2 ロゼヴァーゴ,UpperEyelid,tomei　下まつげライアーライナー,LowerEyelash,emotao　つけまつげ / M9,UpperEyelash,アイプチ　ひとえ・奥ぶたえ用カーラー,UpperEyelash,ペリペラ　インクブラック カラ(AD)-ロングラッシュカーリング / 1,UpperEyelash,rom&nd ハンオールブロウカラ / 04 MERRY BLONDY,Brow,ケイト　デザイニングアイブロウ3D / EX-4　（２）　〓〓〓　ケイト　デザイニングアイブロウ3D / EX-4　（３）,Brow,JUDYDOLL　フィックスハイライトパクト / ＃０２オーツミルクラテ　（１）,Brow,rom&nd　ベターザンシェイプ / Oat Grain　（２）,Nose,rom&nd　ベターザンシェイプ / Oat Grain　（１）,Nose,rom&nd　ベターザンシェイプ / Oat Grain　（？）,Chin,rom&nd　ベターザンシェイプ / Oat Grain　（？）,Face,[アイシャドウパレット],Chin,[アイシャドウパレット],Cheek,[アイシャドウパレット],Nose,JUDYDOLL　フィックスハイライトパクト / ＃０２オーツミルクラテ　（１）,Nose,JUDYDOLL　フィックスハイライトパクト / ＃０２オーツミルクラテ　（１）,LowerEyelid,JUDYDOLL　フィックスハイライトパクト / ＃０２オーツミルクラテ　（１）,Nose,CLIO　プリズム エアー ハイライター / 1号 ゴールドシアー,Nose,CLIO　プリズム エアー ハイライター / 1号 ゴールドシアー,Chin,[パウダー],Powder,[コンシーラー],Lip,FLORETTE　キュートシングススーパーマーケット マットリップ / 01,Lip,rom&nd　ジューシーラスティングティント / 34 bare tangerine,Lip,Dinto　ブラーグロイリップティント / 206グラティア,Lip,,,,,,
WZwfvhNOYpc,ハウスダスト,44787.20833,黒髪サブカル(風)メイクが可愛すぎる…Y2K、ギャル要素も入れてイマドキ顔をGETだぜ?!!??,このメイクは普段からするくらいスキ!!?? ▽ファンレター・プレゼント宛先 動画や各SNSで紹介させていただくことがあります ...,あり,CandyDoll(キャンディドール)　ブライトピュアベースCC / レモン,Base,CathyDoll(キャシードール)　ヌードマットブラッシャー / 02 Easy Peach,LowerEyelid,メイベリン ニューヨーク　フィットミー リキッド ファンデーション R / 110,Foundation,LUNA　ロングラスティングチップ コンシーラー / 01 バニラ,Concealer,キャンメイク　カラーミキシングコンシーラー / No.01 ライトベージュ　（１）,Concealer,Chacott COSMETICS(チャコット・コスメティクス)　フィニッシングパウダー モイスト / 771 ナチュラル,Powder,キャンメイク　ラスティングマルチアイベース WP / 01 フロスティクリア,UpperEyelid,UR GLAM　マルチアイパレット / ブリックブラウン　（２）,UpperEyelid,UR GLAM　マルチアイパレット / ブリックブラウン　（３）,LowerEyelid,UR GLAM　マルチアイパレット / ブリックブラウン　（５）,UpperEyeline,UR GLAM　マルチアイパレット / ブリックブラウン　（５）,LowerEyeline,UR GLAM　マルチアイパレット / ブリックブラウン　（５）,LowerEyelid,[二重テープ],DoubuleEyelid,UR GLAM　マルチアイパレット / ブリックブラウン　（５）,UpperEyelid,UR GLAM　マルチアイパレット / ブリックブラウン　（５）,LowerEyelid,Perfect Diary　リキッドアイライナー / 01,UpperEyeline,the SAEM　カバーパーフェクションコンシーラーペンシル / 1.0 Clear Beige,LowerEyelid,UR GLAM　マルチアイパレット / ブリックブラウン　（１）,UpperEyelid,UR GLAM　マルチアイパレット / ブリックブラウン　（１）,LowerEyelid,メイベリン ニューヨーク　ハイパーシャープ ライナー R / BK-2 ソフトブラック,LowerEyelash,アイプチ　ひとえ・奥ぶたえ用カーラー,UpperEyelash,コーセーコスメニエンス　カールキープマジック / クリアブラック,UpperEyelash,ビューティーネイラー アイラッシュバリューパック / VP-43,UpperEyelash,the SAEM　カバーパーフェクションコンシーラーペンシル / 1.0 Clear Beige,LowerEyelid,ケイト　デザイニングアイブロウ3D / EX-7　（１）　〓〓〓　ケイト　デザイニングアイブロウ3D / EX-7　（２）,Brow,ケイト　デザイニングアイブロウ3D / EX-7　（１）,Brow,キャンメイク　シェーディングパウダー / No.04 アイスグレーブラウン,Nose,too cool for school　アートクラスバイロダンシェーディングマスター / 01クラシック,Face,セザンヌ　パールグロウハイライト / 01 シャンパンベージュ,Nose,Perfect Diary　リキッドアイライナー / 01,UpperEyeline,UR GLAM　マルチアイパレット / ブリックブラウン　（３）　〓〓〓　UR GLAM　マルチアイパレット / ブリックブラウン　（５）,Lip,rom&nd　ゼロベルベットティント / #06 Deep Soul,Lip,MERZY　バイトザビートメロウティント / M4. BIAN ROSE,Lip,[？],Mole,A’pieu（アピュー）　アピュー ジューシーパン メレンゲチーク / PK01 ピーチメレンゲ,Cheek,,,,,,,,,,,,,,,,,,,,,,
B6ojrLOi-JI,『ゆきぽよTV!』,2019-06-13 21:00:02+00:00,【最新】ゆきぽよの毎日メイク！【ゆきぽよ】,お久しぶりの毎日メイク??！     使ってるコスメほとんどM・A・Cなのは相変わらずです?！笑 みんなもぜひ参考にしてみて ...,〇,M・A・C ライトフル C+ ティンティッド クリーム SPF 30 / ？,Base,M・A・C　ライトフル C+ SPF 50 クイック フィニッシュ クッション コンパクト,Foundation,M・A・C スモール　アイシャドウ / ？,UpperEyelid,M・A・C　ダズルシャドウ / ドリーミー ビームス,UpperEyelid,[ビューラー],UpperEyelash,メイベリン ニューヨーク　ラッシュニスタ オイリシャス / 01 ブラック,UpperEyelash,メイベリン ニューヨーク　ハイパーシャープ ライナー R / BK-1 漆黒ブラック,UpperEyeline,M・A・C　ダズルシャドウ / ドリーミー ビームス,LowerEyeline,M・A・C スモール アイシャドウ / ゴールドマイン,LowerEyelid,M・A・C スモール アイシャドウ / ゴールドマイン,UpperEyelid,メイベリン ニューヨーク　ラッシュニスタ オイリシャス / 01 ブラック,LowerEyelash,Diamond Lash(デイコレクション)　リトルウィンクシリーズ シークレットeye,UpperEyelash,ケイト　ダブルラインエキスパート,LowerEyelid,ケイト　ダブルラインエキスパート,UpperEyelash,M・A・C グレイト ブロウ / ？　（２）,Brow,M・A・C グレイト ブロウ / ？　（２）,Nose,[眉マスカラ],Brow,M・A・C　エクストラ ディメンション スキンフィニッシュ / オー ダーリン,Cheek,M・A・C　エクストラ ディメンション スキンフィニッシュ / オー ダーリン,Nose,M・A・C　エクストラ ディメンション スキンフィニッシュ / オー ダーリン,Chin,M・A・C　エクストラ ディメンション スキンフィニッシュ / オー ダーリン,Lip,M・A・C　ミネラライズ ブラッシュ / ジェントル,Cheek,M・A・C　リップテンシティ リップスティック / スモークド アーモンド,Lip,M・A・C　ブリング シング リキッド リップ トップコート / デリシャスリー ディスラプティブ,Lip,,,,,,,,,,,,,,,,,,,,,,,,,,,,,,,,,,,,,,,,,,,,
YOySlLBF1cg,KAWAII PATEEN,2015-06-06 19:00:01+00:00,Kuro Gyaru MAKEUP TUTORIAL by Japanese model HARUTAM Black Diamond leader| ブラックダイアモンドはるたむの黒ギャルメイク講座,Watch all the videos with Black Diamond : https://www.youtube.com/playlist?list=PL7k_Q9ypWTRKmCJwLBt-WJMgLcq-KYlkP ...,Rodeo PINKDEVIL ULTRABIG,M・A・C　プレップ プライム フェイス プロテクト SPF 50,Base,M・A・C　スタジオ フィックス フルイッド SPF 15 / NC30,Foundation,M・A・C　スタジオ フィックス フルイッド SPF 15 / NC36,Foundation,CandyDoll(キャンディドール)　パレットコンシーラー　（３）,Concealer,AC by Angelcolor(エーシー バイ エンジェルカラー)　キキ＆ララパウダー,Powder,ドーリーウインク　クリームアイシャドウ / No.1 ゴールド,UpperEyelid,M・A・C　スモール アイシャドウ,UpperEyelid,[アイシャドウ],UpperEyelid,クレアボーテ　ラブダーリン アイライナー / ブラック,UpperEyeline,ドーリーウインク　ペンシルアイカラー,LowerEyelid,クレアボーテ　ラブダーリン アイライナー / ブラック,LowerEyeline,メイベリン ニューヨーク　ラスティング ドラマ ジェル ライナー,UpperEyeline,[],LowerEyeline,ダイヤモンドラッシュ　3D 1DAYマツエクEYELASH,UpperEyelash,ダイヤモンドラッシュ　3D 1DAYマツエクEYELASH,UpperEyelash,ダイヤモンドラッシュ　3D 1DAYマツエクEYELASH,LowerEyelash,クレアボーテ　ラブダーリン アイライナー / ブラック,UpperEyeline,NYX Professional Makeup　LIQUID CRYSTAL LINER,LowerEyelid,シュウ ウエムラ　アイラッシュ カーラー,UpperEyelash,ビボ　ビボ アイフル マユズミA,Brow,ヘビーローテーション　カラーリングアイブロウ / ？,Brow,ケイト　スティックコンシーラーA / ？,Nose,M・A・C　ミネラライズ スキンフィニッシュ/ナチュラル,Forehead,M・A・C　ミネラライズ スキンフィニッシュ/ナチュラル,Cheek,M・A・C　ミネラライズ スキンフィニッシュ/ナチュラル,Chin,M・A・C　ミネラライズ スキンフィニッシュ/ナチュラル,Nose,ケイト　デザイニングアイブロウＮ / ？,Nose,M・A・C　ミネラライズ ブラッシュ / ？,Cheek,[シャドウ],Face,サベックス スティック / ？,Lip,M・A・C　リップスティック / ミス,Lip,,,,,,,,,,,,,,,,,,,,,,,,,,,,,,
fbdo2FjL66o,五彩緋夏 ひなちゃん5しゃい,2022-03-23 20:05:21+00:00,結局ぎゃるしか勝たんのだよ??地雷系ギャルメイク???,https://www.amazon.co.jp/gp/product/B08ZSW95DB/ref=ppx_yo_dt_b_asin_title_o00_s00?ie=UTF8&psc=1 使ったウィッグ！,アキュビュー　Define フレッシュシリーズ フレッシュローズ,[下地],Base,ヴィセ　ヴィセ リシェ フィルタースキン リキッド / OC-405,Foundation,ポール ＆ ジョー ボーテ　モイスチュアライジング ファンデーション プライマー / 01,Base,WHOMEE　フーミー キニシーラー / ナチュラルオレンジ　（２）,Concealer,ケイト　ダークローズシャドウ / RD-1　（１）　〓〓〓　ケイト　ダークローズシャドウ / RD-1　（２）,UpperEyelid,ケイト　ダークローズシャドウ / RD-1　（１）,UpperEyelid,A.BLACK　グラムチェンジマルチパレット / 05 Velvet Wine　（９）,UpperEyelid,ケイト　ダークローズシャドウ / RD-1　（１）,UpperEyelid,MiliMAGE　グリッターライジングシャドウ / #08 tootyfruity,UpperEyelid,ケイト　ダークローズシャドウ / RD-1　（３）,UpperEyelid,A.BLACK　グラムチェンジマルチパレット / 05 Velvet Wine　（１）　〓〓〓　A.BLACK　グラムチェンジマルチパレット / 05 Velvet Wine　（４）,LowerEyelid,キャンメイク　パーフェクトマルチアイズ / 01・ローズブラウン　（４）,LowerEyelid,キャンメイク　パーフェクトマルチアイズ / 01・ローズブラウン　（５）,LowerEyelid,ケイト　ダークローズシャドウ / RD-1　（３）,LowerEyelid,ケイト　ダークローズシャドウ / RD-1　（３）,LowerEyeline,A.BLACK　グラムチェンジマルチパレット / 05 Velvet Wine　（９）,LowerEyelid,Flynn　ライトキャッチャーリキッドグリッター / 02 ピンクライト,LowerEyelid,rom&nd　ベターザンパレット / 00ライト＆グリッターガーデン　（１）,LowerEyelid,セザンヌ　極細アイライナー EX / 10 ブラック,UpperEyeline,ケイト　ダークローズシャドウ / RD-1　（１）,UpperEyelid,ドーリーウインク　マイベストライナー / スモーキーグレー,UpperEyeline,ビー・エヌ　Lash Geek つけまつげ / LSG-01,UpperEyelash,[ビューラー],UpperEyelash,[マスカラ],UpperEyelash,アイプチ　アイプチ リキッドテープN,LowerEyelash,LOUJENE(ルージーン)　LJ 内緒のつけまつげ,LowerEyelash,[マスカラ],UpperEyelash,ドーリーウインク　マイベストライナー / スモーキーグレー,LowerEyelash,キャンメイク　パーフェクトマルチアイズ / 04・クラシックピンク　（？）,Brow,ヘビーローテーション　カラーリングアイブロウ / 03 アッシュブラウン,Brow,WHOMEE　フーミー キニシーラー / ナチュラルオレンジ　（２）,Brow,レブロン　カラーステイ サテン インク / 005 シルキー シエナ,Lip,peripera　インク ムード ドロップ ティント / 06 リアルチェリー,Lip,A’pieu（アピュー）　ジューシーパン ジェリーチーク / JPK01：ラブリーチェリー ,Cheek,CLIO　プリズムハイライターデュオ / 02 ラベンダー ボヤージュ　（２）,Nose,CLIO　プリズムハイライターデュオ / 02 ラベンダー ボヤージュ　（２）,UpperEyelid,CLIO　プリズムハイライターデュオ / 02 ラベンダー ボヤージュ　（２）,Chin,,,,,,,,,,,,,,,,,,
HMShMWfk83E,egg Channel,2021-09-22 17:00:03+00:00,現役JS・JC・JK達の放課後ギャルメイク💖あどけなさ満点で激かわです✨【じゅな&amp;マリサ＆まなぺこ】【make up】,誰でも放課後、週末だけでもギャルになれる❤‼ 超絶ぴちぴちギャル達のメイク動画を紹介  ✨ ▽ゲストで登場してくれたジュナ ...,Dreamy ドリーミー　エターナルブラウン,MISSHA（ミシャ　 M クッション ファンデーション(モイスチャー),Foundation,UR GLAM　カバー＆ハイライト コンシーラー / 明るい肌色,Concealer,キャンメイク　トランスペアレントフィニッシュパウダー / No.SA シャイニーアクアマリン,Powder,キャンメイク　ミックスアイブロウ / No.05 モカブラウン　（３）,Brow,キャンメイク　ミックスアイブロウ / No.05 モカブラウン　（１）　〓〓〓　キャンメイク　ミックスアイブロウ / No.05 モカブラウン　（２）,Brow,ヘビーローテーション　カラーリングアイブロウ / 05 ライトブラウン,Brow,キャンメイク　3wayスリムシェードライナー / 02 アッシュブラウン,Brow,UR GLAM　カバー＆ハイライト コンシーラー / 明るい肌色,Brow,DAISO　アイテープ（絆創膏タイプ、スリム、１２２枚）,DoubuleEyelid,キャンメイク　アイシャドウベース / PP ピンクパール,UpperEyelid,VAVI MELLO(バビメロ) バレンタインボックス / ？　（９）,UpperEyelid,VAVI MELLO(バビメロ) バレンタインボックス / ？　（１２）,UpperEyelid,VAVI MELLO(バビメロ) バレンタインボックス / ？　（１２）,LowerEyelid,VAVI MELLO(バビメロ) バレンタインボックス / ？　（６）,UpperEyelid,VAVI MELLO(バビメロ) バレンタインボックス / ？　（７）,UpperEyelid,キャンメイク　3wayスリムシェードライナー / 02 アッシュブラウン,UpperEyelid,msh(エム・エス・エイチ)　ラブ・ライナー リキッドアイライナーR3 / ブラック,UpperEyeline,キャンメイク　アイラッシュカーラー,UpperEyelash,[つけまつげ],UpperEyelash,キャンメイク　クリーミータッチライナー / No.01 ディープブラック,LowerEyeline,キャンメイク　パーフェクトスタイリストアイズ / No.23 アーモンドカヌレ　（５）,LowerEyelid,キャンメイク　クリーミータッチライナー / No.01 ディープブラック,UpperEyelid,ケイト　ザ アイカラー / 001,LowerEyelid,キャンメイク　3wayスリムシェードライナー / 02 アッシュブラウン,LowerEyelid,ケイト　ラッシュマキシマイザーHP,UpperEyelash,ケイト　ラッシュマキシマイザーHP,LowerEyelash,メイベリン　ニューヨーク ラッシュニスタ N / NT01 ブラック,UpperEyelash,メイベリン　ニューヨーク ラッシュニスタ N / NT01 ブラック,LowerEyelash,キャンメイク　ミックスアイブロウ / No.05 モカブラウン　（２）　〓〓〓　キャンメイク　ミックスアイブロウ / No.05 モカブラウン　（３）,Nose,キャンメイク　ミックスアイブロウ / No.05 モカブラウン　（１）　〓〓〓　キャンメイク　ミックスアイブロウ / No.05 モカブラウン　（２）,Nose,セザンヌ　パールグロウハイライト / 03 オーロラミント,Nose,セザンヌ　パールグロウハイライト / 03 オーロラミント,Chin,セザンヌ　パールグロウハイライト / 03 オーロラミント,Forehead,セザンヌ　パールグロウハイライト / 03 オーロラミント,Cheek,シャネル　プードゥル ルミエール / 10 アイヴォリー ゴールド,Nose,キャンメイク　マットフルールシェーディング / No.02 ダークブラウン　（？）,Face,キャンメイク　マットフルールシェーディング / No.02 ダークブラウン　（２）,Forehead,リンメル　ラスティング プロボカリプス リップカラー / ？,Lip,[チーク],Cheek,,,,,,,,,,,,,,
