videoId,channelTitle,publishedAt,title,description,Contact,Product 1,Location 1,Product 2,Location 2,Product 3,Location 3,Product 4,Location 4,Product 5,Location 5 ,Product 6,Location 6,製品ID 7,場所 7,製品ID 8,場所 8,製品ID 9,場所 9,製品ID 10,場所 10,製品ID 11,場所 11,製品ID 12,場所 12,製品ID 13,場所 13,製品ID 14,場所 14,製品ID 15,場所 15,製品ID 16,場所 16,製品ID 17,場所 17,製品ID 18,場所 18,製品ID 19,場所 19,製品ID 20,場所 20,製品ID 21,場所 21,製品ID 22,場所 22,製品ID 23,場所 23,製品ID 24,場所 24,製品ID 25,場所 25,製品ID 26,場所 26,製品ID 27,場所 27,製品ID 28,場所 28,製品ID 29,場所 29,製品ID 30,場所 30,製品ID 31,場所 31,製品ID 32,場所 32,製品ID 33,場所 33,製品ID 34,場所 34,製品ID 35,場所 35,製品ID 36,場所 36,製品ID 37,場所 37,製品ID 38,場所 38,製品ID 39,場所 39,製品ID 40,場所 40,製品ID 41,場所 41,製品ID 42,場所 42,製品ID 43,場所 43,製品ID 44,場所 44,製品ID 45,場所 45,製品ID 46,場所 46
SZRTB4xom3U,nanakoななこ,2020-01-30 19:03:43+00:00,【就活メイク】清潔感溢れ出るしっかりして見えるナチュラルメイク！ タレ眉をアーチ眉に！失敗しない方法,こんにちは！ななこです！ 今日もご視聴ありがとうございます！！   Instagram❥ https://www.instagram.com/_nana.,なし,ポール ＆ ジョー ボーテ　モイスチュアライジング ファンデーション プライマー / 01,Base,ケイト　スキンカラーコントロールベース / PK,Base,シュウ ウエムラ　アンリミテッド ラスティング フルイド / 463,Foundation,イプサ　クリエイティブコンシーラーe　（２）,Concealer,アストレア ヴィルゴ　アイビューティーフィクサーWP,DoubuleEyelid,too cool for school　アートクラスバイロダンシェーディングマスター / 01クラシック　（１）,Face,セザンヌ　ノーズ＆アイブロウパウダー / 02ナチュラル　（１）,Nose,THREE　シマリング グロー デュオ / 01　（２）,Nose,THREE　シマリング グロー デュオ / 01　（２）,Cheek,THREE　シマリング グロー デュオ / 01　（２）,Brow,THREE　シマリング グロー デュオ / 01　（２）,Chin,THREE　シマリング グロー デュオ / 01　（２）,Lip,コスメデコルテ　フェイスパウダー / 00 translucent,Powder,ケイト　デザイニングアイブロウ3D / EX-7　（２）　〓〓〓　ケイト　デザイニングアイブロウ3D / EX-7　（３）,Brow,インテグレート　ニュアンスアイブローマスカラ / BR380,Brow,ちふれ　スポット メーキャップ カバー,Brow,MOART　ベルベット ブラッシャー / 3 FULL OF GINGER,Cheek,MOART　ベルベット ブラッシャー / 3 FULL OF GINGER,Chin,MOART　ベルベット ブラッシャー / 3 FULL OF GINGER,Nose,MOART　ベルベット ブラッシャー / 3 FULL OF GINGER,UpperEyelid,オペラ　リップティント N / 05 コーラルピンク ,Lip,A’pieu（アピュー）　ジューシーパン ティント / BE01うっかりイチジク,Lip,エクセル　スキニーリッチシャドウ / SR06 センシュアルブラウン　（２）,UpperEyelid,エクセル　スキニーリッチシャドウ / SR06 センシュアルブラウン　（３）,UpperEyelid,エクセル　スキニーリッチシャドウ / SR06 センシュアルブラウン　（４）,UpperEyeline,エクセル　スキニーリッチシャドウ / SR06 センシュアルブラウン　（４）,LowerEyelid,エクセル　スキニーリッチシャドウ / SR06 センシュアルブラウン　（１）,UpperEyelid,エクセル　スキニーリッチシャドウ / SR06 センシュアルブラウン　（２）　〓〓〓　エクセル　スキニーリッチシャドウ / SR06 センシュアルブラウン　（３）,LowerEyelid,エクセル　スキニーリッチシャドウ / SR06 センシュアルブラウン　（１）,UpperEyelid,キャンメイク　クリーミータッチライナー / No.02 ミディアムブラウン,UpperEyeline,資生堂　アイラッシュカーラー 213,UpperEyelash,デジャヴュ塗るつけまつげ ラッシュアップ / ラッシュアップ(ブラック),UpperEyelash,デジャヴュ塗るつけまつげ ラッシュアップ / ラッシュアップ(ブラック),LowerEyelash,UZU BY FLOWFUSHI　UZU アイオープニングライナー / BURGUNDY(バーガンディ),LowerEyeline,,,,,,,,,,,,,,,,,,,,,,,,
cZXvaAZ2CRk,アオイの。,2020-02-07 21:00:20+00:00,【毎日メイク】私の2020年春夏メイクはナチュラルメイク！,最近たくさん質問にも頂いていた私の毎日メイク！ ここ数週間、春夏に向けてメイクを研究していたんだけど 私は、ツヤ肌 ...,なし,NARS　ティンティッドグローブースター / 2183,Base,NARS　ラディアントクリーミーコンシーラー / 1244,Concealer,NARS　ナチュラルラディアント ロングウェア クッションファンデーション / 5882(ダブルレフィル),Foundation,NARS　ライトリフレクティングセッティングパウダー プレスト N / 5894,Powder,NARS　シングルアイシャドー / 5311　〓〓〓　NARS シングルアイシャドー / 5312,Brow,NARS　ブローパーフェクター / 1133,Brow,NARS　アフターグロー リップバーム / 1359,Lip,NARS　ブラッシュ / 4011N,Cheek,NARS　ブラッシュ / 4078,Cheek,NARS　オーバーラスト チークパレット　（１）,Nose,NARS　オーバーラスト チークパレット　（１）,Cheek,NARS　オーバーラスト チークパレット　（２）,UpperEyelid,NARS　オーバーラスト チークパレット　（２）,LowerEyelid,NARS　アフターグロー アイシャドーパレット　（１０）,UpperEyelid,NARS　アフターグロー アイシャドーパレット　（１０）,LowerEyelid,NARS　ハイピグメント ロングウェアアイライナー / 8194,UpperEyeline,NARS　クライマックス マスカラ / 7008,UpperEyelash,NARS　アフターグロー リップバーム / 1359,Lip,NARS　オーデイシャスリップスティック / 9461,Lip,,,,,,,,,,,,,,,,,,,,,,,,,,,,,,,,,,,,,,,,,,,,,,,,,,,,,,
MKmaTT_-tCE,nanakoななこ,2021-06-27 21:31:02+00:00,【絶対可愛くなる！】プチプラコスメで垢抜け一重奥二重メイク！黒髪必見！超好印象♡【学生必見】【ドラックストア購入品】,ナチュラルメイクです（大声！！！！） ドラックストアで買えるプチプラコスメで好印象なナチュラルメイク（垢抜けメイク）を ...,なし,インテグレート　すっぴんメイカー ＣＣリキッド,Base,エテュセ　フェイスエディション(コンシーラー) / 01 ライトベージュ,Concealer,キャンメイク　カラースティック モイストラスティングカバー / No.04 アプリコット,Concealer,ケイト　デザイニングアイブロウ3D / EX-7　（３）,Nose,ケイト　デザイニングアイブロウ3D / EX-7　（２）,Brow,ヘビーローテーション　カラーリングアイブロウ / 03 アッシュブラウン,Brow,キャンメイク　マットフルールシェーディング / No.01 ナチュラルブラウン　（１）　〓〓〓　キャンメイク　マットフルールシェーディング / No.01 ナチュラルブラウン　（２）　〓〓〓　キャンメイク　マットフルールシェーディング / No.01 ナチュラルブラウン　（３）　〓〓〓　キャンメイク　マットフルールシェーディング / No.01 ナチュラルブラウン　（４）　〓〓〓　キャンメイク　マットフルールシェーディング / No.01 ナチュラルブラウン　（５）,Face,セザンヌ　パールグロウハイライト / 01 シャンパンベージュ,Nose,セザンヌ　パールグロウハイライト / 01 シャンパンベージュ,Forehead,セザンヌ　パールグロウハイライト / 01 シャンパンベージュ,Lip,セザンヌ　パールグロウハイライト / 01 シャンパンベージュ,Chin,セザンヌ　ナチュラル チークN / 101 ホットピンク,Cheek,セザンヌ　ナチュラル チークN / 101 ホットピンク,Chin,セザンヌ　ナチュラル チークN / 101 ホットピンク,Forehead,セザンヌ　ナチュラル チークN / 101 ホットピンク,Nose,キャンメイク　マシュマロフィニッシュパウダー / ML マットライトオークル,Powder,オペラ　リップティント N / 103 ガーネットジェム,Lip,キャンメイク　シルキースフレアイズ / No.07 ネクタリンオレンジ　（１）,UpperEyelid,キャンメイク　シルキースフレアイズ / No.07 ネクタリンオレンジ　（３）,UpperEyelid,エクセル　リアルクローズシャドウ(旧) / CS08 アプリコットタータン　（３）,UpperEyelid,エクセル　リアルクローズシャドウ(旧) / CS08 アプリコットタータン　（１）,UpperEyelid,キャンメイク　シルキースフレアイズ / No.07 ネクタリンオレンジ　（４）,UpperEyelid,キャンメイク　シルキースフレアイズ / No.07 ネクタリンオレンジ　（２）,LowerEyelid,キャンメイク　シルキースフレアイズ / No.07 ネクタリンオレンジ　（２）,UpperEyelid,セザンヌ　超細芯アイブロウ / 02 オリーブブラウン,LowerEyelid,エクセル　リアルクローズシャドウ(旧) / CS08 アプリコットタータン　（４）,LowerEyelid,ヒロインメイク　スムースリキッドアイライナー スーパーキープ / 02 ビターブラウン,UpperEyeline,ケイト　コンシャスライナーカラー / 05 ダスティーピンク,UpperEyeline,コージー　カービングアイラッシュカーラー,UpperEyelash,キャンメイク　クイックラッシュカーラー / 透明タイプ,UpperEyelash,ヒロインメイク　ロングUPマスカラ スーパーWP / 01 ブラック,UpperEyelash,イニスフリー　トゥインクル グリッター / 3,LowerEyelid,エテュセ　リップエディション(ティントルージュ） / 07 チョコレートブラウン,Lip,リンメル　ラスティングフィニッシュ ティントリップ / 103,Lip,,,,,,,,,,,,,,,,,,,,,,,,
t60QxFECSPU,nanakoななこ,2020-03-17 02:10:25+00:00,【一重・奥二重メイク】目の形を生かした可愛くて優しい印象の春の好印象ジューシーメイク！腫れぼったくならない。つり目も優しい印象に！ナチュラルメイク！,勝ち組だああとか言えばいうほど可愛いから遠ざかるから！！！！ ＼ご視聴ありがとうございます！❤︎／ ❤︎CharMe・グッズ ...,なし,ポール ＆ ジョー ボーテ　モイスチュアライジング ファンデーション プライマー / 01,Base,エチュード　ダブルラスティング ファンデーション / ニュートラルベージュ　〓〓〓　エチュード　ニンフオーラボリューマー,Foundation,カリプソ　マジックコンシーラー / サーモンベージュ,Concealer,イプサ　クリエイティブコンシーラーe　（２）,Concealer,the SAEM CPチップコンシーラー / グリーンベージュ,Concealer,コスメデコルテ　フェイスパウダー / 00 translucent ,Powder,ケイト　デザイニングアイブロウ3D / EX-7　（２）,Brow,キャンメイク　カラーチェンジアイブロウ / No.04 モカベージュ,Brow,ケイト　マルチコントゥアペンシル / 02,Nose,too cool for school　アートクラスバイロダンシェーディングマスター / 01クラシック　（１）,UpperEyelid,UR GLAM　セレクトアイズ / 08 ライトイエロー,Nose,UR GLAM　セレクトアイズ / 08 ライトイエロー,Lip,UR GLAM　セレクトアイズ / 08 ライトイエロー,Chin,ロレアル パリ　ル バー ア ブラッシュ / 15パッショネイト,Cheek,UR GLAM　セレクトアイズ / 08 ライトイエロー,Brow,rom&nd　ジューシーラスティングティント / 08 APPLE BROWN,Lip,VAVI MELLO(バビメロ)　バレンタインボックス2 ピーチパレット　（２）,UpperEyelid,VAVI MELLO(バビメロ)　バレンタインボックス2 ピーチパレット　（９）,UpperEyelid,VAVI MELLO(バビメロ)　バレンタインボックス2 ピーチパレット　（６）,UpperEyelid,VAVI MELLO(バビメロ)　バレンタインボックス2 ピーチパレット　（３）,LowerEyelid,VAVI MELLO(バビメロ)　バレンタインボックス2 ピーチパレット　（７）,LowerEyelid,msh(エム・エス・エイチ)　ラブ・ライナー リキッドアイライナーR4 / ミルクブラウン,UpperEyeline,エチュード　ティアー アイライナー / BE101,LowerEyeline,アイプチ　ひとえ・奥ぶたえ用カーラー,UpperEyelash,ケイト　ラッシュマキシマイザー / EX-1,UpperEyelash,マジョリカ マジョルカ　ラッシュエキスパンダー ロングロングロング / BK999 ディファインブラック,UpperEyelash,A'PIEU(海外)　ジューシーウォーターブラッシャー / OR01 APPRICOT,Cheek,3CE　デュアルブレンドブラッシャー / ブルーミングアゲイン　（１）,Cheek,too cool for school　アートクラスバイロダンシェーディングマスター / 01クラシック　（１）,Face,,,,,,,,,,,,,,,,,,,,,,,,,,,,,,,,,,
4M1MxWXxnYQ,水越みさと,2023-01-21 19:00:02+00:00,【濃いメイク似合わない人】メイクするほど不自然になってしまう方に見てほしい。しっかり盛れるナチュラルメイク♡,タイムテーブルはまた時間のある時に書きますね！ ＊Instagram＊https://www.instagram.com/mitan.m/ ...,なし,hince セカンドスキントーンアップベース / ライトピーチ,Base,イヴ・サンローラン　ラディアント タッチ グロウパクト / B20,Foundation,コスメデコルテ　トーンパーフェクティング パレット / 00 ライト　（４）,Concealer,コスメデコルテ　トーンパーフェクティング パレット / 00 ライト　（２）　〓〓〓　コスメデコルテ　トーンパーフェクティング パレット / 00 ライト　（４）,Concealer,RMK　RMK ルミナス ペンブラッシュコンシーラー / 01,Concealer,コスメデコルテ　トーンパーフェクティング パレット / 00 ライト　（４）,Concealer,Wonjungyo　ウォンジョンヨ フィクシングブラーパウダー / 01 プレーンピンク,Powder,rom&nd　ハンオールシェードライナー / 07 CREAMY BEIGE クリーミーベージュ,LowerEyelid,dasique　シャドウパレット / 03 Nude Potion　（５）,UpperEyelid,dasique　シャドウパレット / 03 Nude Potion　（５）,LowerEyelid,dasique　シャドウパレット / 03 Nude Potion　（９）,UpperEyelid,dasique　シャドウパレット / 03 Nude Potion　（８）,UpperEyelid,D-UP(ディーアップ)　シルキーリキッドアイライナーWP / シフォンブラウン,UpperEyeline,キャンメイク　クリーミータッチライナー / 09 ダージリンピンク,UpperEyelid,Flynn　アンリミットロングアンドカールマスカラ,UpperEyelash,dasique　シャドウパレット / 03 Nude Potion　（３）,LowerEyelid,キャンメイク　クリーミータッチライナー / 09 ダージリンピンク,LowerEyeline,セザンヌ　グロウリキッドライナー / 20 ムーンベージュ,LowerEyelid,イプサ　アイブロウ クリエイティブパレット　（１）　〓〓〓　イプサ　アイブロウ クリエイティブパレット　（２）,Brow,イプサ　アイブロウ クリエイティブパレット　（１）　〓〓〓　イプサ　アイブロウ クリエイティブパレット　（２）,Nose,ケイト　3DアイブロウカラーN / BR-5 ローズブラウン,Brow,イプサ　アイブロウ クリエイティブパレット　（１）　〓〓〓　イプサ　アイブロウ クリエイティブパレット　（２）,LowerEyelid,[ハイライト],Nose,MOS　エアーブリーズマットティント / 606 アイディリックコーラル,Lip,rom&nd　グラスティングウォーターグロス / 00 メテオ・トラック,Lip,[シェーディング],Face,ローラ メルシエ　ブラッシュ カラー インフュージョン / 11,Cheek,TIRTIR　MY GLOW HIGHLIGHTER / LILYFUL,Cheek,,,,,,,,,,,,,,,,,,,,,,,,,,,,,,,,,,,,
jiPmPxkqdMg,水越みさと,2023-05-12 19:00:37+00:00,【※同じコスメでメイクしています】メイクしてもすっぴんと変わらない‥！でも濃くしたいわけじゃない方に見てほしい。メイクした感を出せるナチュラルメイク！,みなさんこんにちは。水越みさとです。 以前インスタで募集した際にも多かったお悩み メイクしたのにすっぴんみたいにみえる ...,なし,msh(エム・エス・エイチ)　タイムシークレット ミネラル 薬用プライマーベース / ピンク,Base,イプサ　リキッド ファウンデイションe / ？,Foundation,dasique　プロコンシーラーパレット　（７）,Concealer,dasique　プロコンシーラーパレット　（５）　〓〓〓　dasique　プロコンシーラーパレット　（８）,Concealer,NARS　ライトリフレクティングセッティングパウダー ルース,Powder,dasique　シャドウパレット / 05 Sunset Muhly　（１）,UpperEyelid,dasique　シャドウパレット / 05 Sunset Muhly　（４）,UpperEyelid,dasique　シャドウパレット / 05 Sunset Muhly　（７）,UpperEyelid,dasique　シャドウパレット / 05 Sunset Muhly　（１）,UpperEyelid,dasique　シャドウパレット / 05 Sunset Muhly　（４）,UpperEyelid,dasique　シャドウパレット / 05 Sunset Muhly　（７）,UpperEyelid,dasique　シャドウパレット / 05 Sunset Muhly　（９）,UpperEyelid,dasique　シャドウパレット / 05 Sunset Muhly　（１）,LowerEyelid,dasique　シャドウパレット / 05 Sunset Muhly　（４）,LowerEyelid,dasique　シャドウパレット / 05 Sunset Muhly　（９）,LowerEyelid,Ririmew　アイラッシュカーラー,UpperEyelash,mude　MDインスパイアロングラッシュカーリングマスカラ / #01 ブラック,UpperEyelash,メイベリン ニューヨーク　ハイパーシャープ ライナー R / BK-1 漆黒ブラック,UpperEyeline,msh(エム・エス・エイチ)　ラブ・ライナー シグネチャーフィットパウダー / ルビーショコラ　（３）,Brow,セザンヌ　超細芯アイブロウ / 04 ディープブラウン,Brow,ケイト　3DアイブロウカラーN / BR-5 ローズブラウン,Brow,ヴィセ　ヴィセ シェード トリック　（？）,Nose,to/one　トーン ペタル エッセンス カラー バター / 11,Lip,ボビイ ブラウン　クラッシュド リップ カラー / 35 ココア,Lip,DAISY DOLL by MARY QUANT　デイジードール パウダー ブラッシュ / O-01：ウォームオレンジ,Cheek,エクセル　ドレープド シマーグロウ / DS01 ピンクグロウ,Nose,エクセル　ドレープド シマーグロウ / DS01 ピンクグロウ,Chin,ヴィセ　ヴィセ シェード トリック　（？）,Face,セザンヌ　ジェルアイライナー / 90 テラコッタブラウン,LowerEyeline,ケイト　3DアイブロウカラーN / BR-5 ローズブラウン,LowerEyelid,,,,,,,,,,,,,,,,,,,,,,,,,,,,,,,,
vgSXrvwsPpY,YoshidaAkari,2017-04-04 19:00:03+00:00,【初心者向け】絶対に可愛くなる?プチプラ！ナチュラルメイク?　Beginner Make up Tutorial,おすすめ動画 【デカ目】カールキープ力抜群！アイドル人生で私が産み出した最強まつげメイク法はこれだ！,ReVIA 1day CIRCLE 《ブラウン》,CandyDoll(キャンディドール)　ブライトピュアベースCC / ラベンダー,Base,CandyDoll(キャンディドール)　ハイカバーケアコンシーラー(ライト&オレンジ),Concealer,キャンメイク　マシュマロフィニッシュパウダー / MO マットオークル,Powder,キャンメイク　リップ＆チーク ジェル / No.05 チェリーフロマージュ,Cheek,ケイト　ケイト アイブロウペンシルZ / BR-4,Brow,キス　ナチュラルアイブロウカラーS,Brow,エクセル　スキニーリッチシャドウ / SR01 ベージュブラウン　（２）,UpperEyelid,資生堂　アイラッシュカーラー 213,UpperEyelash,キャンメイク　ジェルラインアーティスト / No.B01 ブラック,UpperEyeline,フローフシ　モテライナー リキッド / ブラウン,UpperEyeline,キャンメイク　フレアリングカールマスカラ,UpperEyelash,ニベア　ニベア ディープモイスチャー リップ,Lip,キャンメイク　リップティントシロップ / No.04 ポピーシロップ,Lip,,,,,,,,,,,,,,,,,,,,,,,,,,,,,,,,,,,,,,,,,,,,,,,,,,,,,,,,,,,,,,,,,,
8B3Fdzm0z6o,椎名亜美 Ami Shiina,2020-12-30 19:00:09+00:00,【ほぼプチプラ】冬の垢抜ける毎日メイクを皆様にご紹介します??,他のメイク動画も見てみてね   画質、かなり良くなってるよ！！ ▽仕込んで盛る最強ナチュラルメイク https://bit.ly/3xv5F5L ...,なし,モウシロ　トーンアップクリーム　ミルクホワイト,Base,ポール ＆ ジョー ボーテ　モイスチュアライジング ファンデーション プライマー / 01,Base,HERA　ブラックコンシーラー ドットカバー / ライトバニラ,Concealer,HERA　アイブライトナー,Concealer,Mamonde(マモンド/韓国)　COTTON VEIL POWDER,Powder,too cool for school　アートクラスバイロダンシェーディングマスター / 01クラシック　（１）,Face,too cool for school　アートクラスバイロダンシェーディングマスター / 01クラシック　（１）,UpperEyelid,too cool for school　アートクラスバイロダンシェーディングマスター / 01クラシック　（１）,Nose,ケイト　アイブロウペンシルA / BR-3,Brow,HERA　ブロウデザイナーパクト / ？,Brow,CLIO　キル ブロウ カラー ブロウ ラッカー / 001 NATURAL BROWN,Brow,too cool for school　アートクラスバイロダンシェーディングマスター / 01クラシック　（１）,Nose,エチュード　プレイカラー アイシャドウ / レザーショップ　（１）,UpperEyelid,エチュード　プレイカラー アイシャドウ / レザーショップ　（３）,LowerEyelid,エチュード　プレイカラー アイシャドウ / レザーショップ　（９）,LowerEyelid,エチュード　プレイカラー アイシャドウ / レザーショップ　（２）,UpperEyelid,キャンメイク　スリムリキッドアイライナー / No.02 ブラウン,UpperEyeline,？,LowerEyelid,？,LowerEyeline,？,UpperEyelash,資生堂　アイラッシュカーラー 213,UpperEyelash,キャンメイク　クイックラッシュカーラー / 透明タイプ,UpperEyelash,キャンメイク　クイックラッシュカーラー / BK ブラック,UpperEyelash,キャンメイク　クイックラッシュカーラー / BK ブラック,LowerEyelash,？,LowerEyelid,エチュード　ティアー アイライナー / PK001,LowerEyelid,MERZY　バイトザビートメロウティント / M2. JANE CHILI,Lip,？,Nose,？,Cheek,？,Chin,エチュード　プレイ101スティックデュオ / #01,Nose,エチュード　プレイ101スティックデュオ / #01,Cheek,,,,,,,,,,,,,,,,,,,,,,,,,,,,
LfDrNem-Oc4,アオイの。,2019-05-29 22:41:29+00:00,【ナチュラルメイク】つや肌命！リップで変わるナチュラルメイク！,リクエストにあったナチュラルメイク！！ リップの色によって、雰囲気を 変えられるように考えてみたよ！！ できるだけ、素肌 ...,なし,ジバンシイ　ランタンポレル ブロッサム クリーム ミスト,Base,ディオール　スノー パーフェクト ライト,Skincare,？,Concealer,ポール ＆ ジョー ボーテ　プロテクティング ファンデーション プライマー S / 02 ハニー,Base,rms beauty　ルミナイザー,Nose,rms beauty　ルミナイザー,Cheek,rms beauty　ルミナイザー,Lip,エクセル　パウダー&ペンシル アイブロウEX / PD05 グレイッシュブラウン,Brow,M・A・C　グレイト ブロウ / トープ　（？）,Brow,rms beauty　ピーチルミナイザー,UpperEyelid,THREE　シマリング グロー デュオ / 02　（１）,UpperEyelid,THREE　シマリング グロー デュオ / 02　（１）,LowerEyelid,M・A・C　M・A・C パワーポイント アイ ペンシル / スタボーン ブラウン,UpperEyeline,資生堂　アイラッシュカーラー 213,UpperEyelash,メイベリン　ニューヨーク スナップスカラ / 07 ダークチェリー,UpperEyelash,メイベリン　ニューヨーク スナップスカラ / 07 ダークチェリー,LowerEyelash,ベネフィット　ダンデライオン,Cheek,M・A・C　リップスティック / シー シアー トーキョー (限定),Lip,RMK　リップスティック コンフォート ブライトリッチ / 10 1997,Lip,,,,,,,,,,,,,,,,,,,,,,,,,,,,,,,,,,,,,,,,,,,,,,,,,,,,,,
